text,label_score,label,target_predict,target_predict_label
"More recently, [40] decomposes image generation into parallel mechanisms (shape, texture, and background) and the distributions over the individual mechanisms are learned.",,,0,not_related
"While scaling datasets and model architectures has worked well, more structured approaches could lead to more data-efficient generalization: for instance, generative models with explicit machinery for counterfactual reasoning (Sauer & Geiger, 2021).",,,0,not_related
", 2020); (vi) increasing robustness against spurious correlations (Sauer and Geiger, 2021).",,,0,not_related
"…al., 2021); (ii) defining fairness (Kusner et al., 2017); (iii) mitigating data biases (Denton et al., 2019); (iv) improving reinforcement learning (Lu et al., 2020); (v) predicting accuracy (Kaushik et al., 2020); (vi) increasing robustness against spurious correlations (Sauer and Geiger, 2021).",,,0,not_related
"StyleGAN-XL inherits this ability and, to a certain extent, even generates out-of-domain combinations between different classes, akin to counterfactual images presented in [53].",,,0,not_related
"Other constructive works aimed to reduce the reliance of deep models on spurious features appeal to counterfactual data generation [1, 6, 17], often appealing to disentangled representations or explicit annotations to break correlations of texture, shapes, colors, and backgrounds.",,,0,not_related
"Sauer and Geiger [26] propose to disentangle object shape, object texture and background in the image generation process and generate structured conterfacturals which help improve the robustness and interpretability of classifiers.",,,0,not_related
", the work [61] specified independent modules for image background and texture.",,,0,not_related
"A growing number of recent work has used causality with machine learning [62] for disentangled representation [54, 78], model explanation [6, 13], and robust prediction [61, 24, 83].",,,0,not_related
"We use two datasets where the target attribute has a correlation strength of over 90% with the confounding factor, following the challenging settings of the latest work on visual bias [73, 17, 61, 65].",,,1,related
"Several latest works have studied causal inference combined with deep generative models for images, to learn causal structures between attributes [78, 65, 51], synthesize novel images [32, 3], and augment unbiased classifier training [61].",,,0,not_related
"The causal lens and generative counterfactual data augmentation have also shown recent, positive results in the computer vision domain [27].",,,0,not_related
"Varying Textures, Backgrounds and More As shown in [14, 29], it is hard to control texture and background in standard GANs.",,,0,not_related
"Pretrained models can be used as a guiding mechanism to disentangle causal generative factors [54], for text-driven image manipulation [44], matching the generator activations to inverted classifiers [19, 56], or to generate images via gradient ascent in the latent space of a generator [41].",,,0,not_related
"Sauer & Geiger (2021) propose a generative framework which allows choosing the color, texture and background of a generated image independently.",,,0,not_related
"Sauer and Geiger [51] proposed to decompose the image generation process into independent causal mechanisms, which disentangle object shape, object texture and background, for generating counterfactual images that improve out-of-distribution robustness.",,,0,not_related
"In previous work, [39, 51] proposed to utilize generative models to produce counterfactual images.",,,0,not_related
"Secondly, unlike [39, 51], our method proposes to generate counterfactual features rather than counterfactual images.",,,0,not_related
"ducing a counterfactual explanation exploit generative models with generative adversarial network (GAN) and its variants [33], [34], [35].",,,0,not_related
"Despite their state-of-the-art performance on object classification tasks, deep neural networks (DNN) are highly prone to shortcut learning [8, 33, 11].",,,0,not_related
"This approach has further been extended to generative model-based augmentations [31, 34, 33].",,,0,not_related
"Recent work shows the benefits of introducing causality into machine learning from various aspects (Zhang et al., 2020a; Mitrovic et al., 2020; Teshima et al., 2020; Tang et al., 2020; Sauer & Geiger, 2020; Tang et al., 2021).",,,0,not_related
"In addition, we will investigate generation module for language understanding with unsupervised generative techniques (Sauer and Geiger, 2021).",,,1,related
"Subsequent works (Wang et al., 2019; Bahng et al., 2020; Shi et al., 2020; Nam et al., 2020; Li et al., 2021; Sauer & Geiger, 2021) focus on addressing the bias problem with explicit debiasing procedure.",,,0,not_related
"Augmentation using GANs can be applied at training time for robustness or test-time for ensembling; while we primarily focus on the latter, concurrent works [35, 50] investigate the benefits of the former approach while [56] investigates intermediate GAN representations for few-shot segmentation.",,,0,not_related
"Along
this direction, for example, Sauer and Geiger (2021) recently combined disentangled generative models and out-of-distribution classification, but adopted a different disentanglement framework.",,,0,not_related
", 2020) is effective for enhancing OOD generalization, which leverages factual and counterfactual samples to push the learning of decision boundary to focus on features causally affect the label (Sauer and Geiger, 2021; Teney et al., 2020).",,,0,not_related
"A set of methods condition the generative model on attributes annotated in the dataset by using a conditional Generative Adversarial
Network (GAN) (Joshi et al., 2018; Liu et al., 2019; Sauer & Geiger, 2021; Van Looveren et al., 2021; Yang et al., 2021).",,,1,related
Our experimental setup is largely based on the description provided by Sauer and Geiger [22].,,,1,related
69 Section 5 concludes this work by discussing our experience with reproducing the research by Sauer and Geiger [22].,,,1,related
"One central 53 principle in causal inference is the assumption of independent mechanisms (IMs), which states that a causal generative 54 process is composed of autonomous modules that do not influence each other [19, 22, 24].",,,0,not_related
The counterfactual generative network is a manifestation of a structural causal model (SCM) for the task of image 72 classification [22].,,,0,not_related
"Throughout this work, we have conducted several experiments to reproduce the main results from the research by 221 Sauer and Geiger [22].",,,0,not_related
"In summary, this work makes the following contributions: 44 • We reproduce the main experiments conducted by Sauer and Geiger [22] to identify which parts of the 45 experimental results supporting their claims can be reproduced, and at what cost in terms of resources (e.",,,1,related
"37 In order to enhance the robustness and interpretability of classifiers, Sauer and Geiger [22] introduce the idea of a 38 Counterfactual Generative Network (CGN).",,,0,not_related
"(2020) employ normalizing flows and variational inference for enabling tractable counterfactual inference, Sanchez & Tsaftaris (2022) use diffusion models for counterfactual estimation, Axel Sauer (2021) proposes counterfactual generative networks, Dash et al.",,,0,not_related
"…inference for enabling tractable counterfactual inference, Sanchez & Tsaftaris (2022) use diffusion models for counterfactual estimation, Axel Sauer (2021) proposes counterfactual generative networks, Dash et al. (2022) incorporates a structural causal model (SCM) in a variant of…",,,0,not_related
"(2020) employ normalizing flows and variational inference for enabling tractable counterfactual inference, Sanchez & Tsaftaris (2022) use diffusion models for counterfactual estimation, Axel Sauer (2021) proposes counterfactual generative networks, Dash et al. (2022) incorporates a structural causal model (SCM) in a variant of Adversarially Learned Inference for generating counterfactual images. Normalizing flow-based methods for answering counterfactual queries has received a lot of attention in no time. For example, Pawlowski et al. (2020)’s work on healthy magnetic resonance images of the brain has been extended to account for the clinical and radiological phenotype of multiple sclerosis (MS) by Reinhold et al. (2021). Wang et al. (2021) perform counterfactual inference to achieve harmonization of brain imaging data with different protocols and from different sites in a clinical study. From a deep learning perspective, an exogenous variable might be considered as an inferred latent variable. To infer the state of the latent noise attached to an endogenous variable, we typically model a normalizing flow, perform amortized variational inference (in the case of very high dimensional variables) (Pawlowski et al., 2020) or use deterministic forward diffusion(Sanchez & Tsaftaris, 2022). Our ability to infer a latent variable comes at a computational cost as well as a statistical cost. To illustrate, the framework for counterfactual estimation by inferring exogenous noises via normalising flows parameterizes each structural assignment of an SCM as an invertible mechanism. Each mechanism explicitly calculates its inverse to enable efficient abduction of exogenous noises. These invertible architectures are typically computationally heavy. For a description of normalizing flows, see Appendix A and Papamakarios et al. (2019). However, given an SCM, in practice, we are interested in counterfactual queries involving a few variables (not all)! For example, Reinhold et al. (2021) studied what the brain image of the subject would look like if the subject did not have lesions, given the observation that they have a 60 mL lesion load. While the proposed SCM consists of age, lesion volume of the subject, duration of MS symptoms, slice number, brain volume, biological sex, image, ventricle volume, and the expanded disability severity score. Hence, it is quite natural to ask for noise variables that we can get rid of from abducting. While Pawlowski et al. (2020) have mentioned (on a footnote) in the case of brain imaging example that abduction of the noise attached to ‘sex’ is not necessary as ‘sex’ has no causal parents in the SCM1 (Figure 5, Pawlowski et al. (2020)), we are unaware of any dedicated effort to identify the noises that must be abducted to answer a counterfactual query.",,,0,not_related
"(2020) employ normalizing flows and variational inference for enabling tractable counterfactual inference, Sanchez & Tsaftaris (2022) use diffusion models for counterfactual estimation, Axel Sauer (2021) proposes counterfactual generative networks, Dash et al. (2022) incorporates a structural causal model (SCM) in a variant of Adversarially Learned Inference for generating counterfactual images. Normalizing flow-based methods for answering counterfactual queries has received a lot of attention in no time. For example, Pawlowski et al. (2020)’s work on healthy magnetic resonance images of the brain has been extended to account for the clinical and radiological phenotype of multiple sclerosis (MS) by Reinhold et al. (2021). Wang et al. (2021) perform counterfactual inference to achieve harmonization of brain imaging data with different protocols and from different sites in a clinical study.",,,0,not_related
"For instance, Pawlowski et al. (2020) employ normalizing flows and variational inference for enabling tractable counterfactual inference, Sanchez & Tsaftaris (2022) use diffusion models for counterfactual estimation, Axel Sauer (2021) proposes counterfactual generative networks, Dash et al. (2022) incorporates a structural causal model (SCM) in a variant of Adversarially Learned Inference for generating counterfactual images.",,,0,not_related
"(2020) employ normalizing flows and variational inference for enabling tractable counterfactual inference, Sanchez & Tsaftaris (2022) use diffusion models for counterfactual estimation, Axel Sauer (2021) proposes counterfactual generative networks, Dash et al. (2022) incorporates a structural causal model (SCM) in a variant of Adversarially Learned Inference for generating counterfactual images. Normalizing flow-based methods for answering counterfactual queries has received a lot of attention in no time. For example, Pawlowski et al. (2020)’s work on healthy magnetic resonance images of the brain has been extended to account for the clinical and radiological phenotype of multiple sclerosis (MS) by Reinhold et al. (2021). Wang et al. (2021) perform counterfactual inference to achieve harmonization of brain imaging data with different protocols and from different sites in a clinical study. From a deep learning perspective, an exogenous variable might be considered as an inferred latent variable. To infer the state of the latent noise attached to an endogenous variable, we typically model a normalizing flow, perform amortized variational inference (in the case of very high dimensional variables) (Pawlowski et al., 2020) or use deterministic forward diffusion(Sanchez & Tsaftaris, 2022). Our ability to infer a latent variable comes at a computational cost as well as a statistical cost. To illustrate, the framework for counterfactual estimation by inferring exogenous noises via normalising flows parameterizes each structural assignment of an SCM as an invertible mechanism. Each mechanism explicitly calculates its inverse to enable efficient abduction of exogenous noises. These invertible architectures are typically computationally heavy. For a description of normalizing flows, see Appendix A and Papamakarios et al. (2019). However, given an SCM, in practice, we are interested in counterfactual queries involving a few variables (not all)! For example, Reinhold et al. (2021) studied what the brain image of the subject would look like if the subject did not have lesions, given the observation that they have a 60 mL lesion load. While the proposed SCM consists of age, lesion volume of the subject, duration of MS symptoms, slice number, brain volume, biological sex, image, ventricle volume, and the expanded disability severity score. Hence, it is quite natural to ask for noise variables that we can get rid of from abducting. While Pawlowski et al. (2020) have mentioned (on a footnote) in the case of brain imaging example that abduction of the noise attached to ‘sex’ is not necessary as ‘sex’ has no causal parents in the SCM1 (Figure 5, Pawlowski et al.",,,0,not_related
"(2020) employ normalizing flows and variational inference for enabling tractable counterfactual inference, Sanchez & Tsaftaris (2022) use diffusion models for counterfactual estimation, Axel Sauer (2021) proposes counterfactual generative networks, Dash et al. (2022) incorporates a structural causal model (SCM) in a variant of Adversarially Learned Inference for generating counterfactual images. Normalizing flow-based methods for answering counterfactual queries has received a lot of attention in no time. For example, Pawlowski et al. (2020)’s work on healthy magnetic resonance images of the brain has been extended to account for the clinical and radiological phenotype of multiple sclerosis (MS) by Reinhold et al. (2021). Wang et al.",,,0,not_related
"(2020) employ normalizing flows and variational inference for enabling tractable counterfactual inference, Sanchez & Tsaftaris (2022) use diffusion models for counterfactual estimation, Axel Sauer (2021) proposes counterfactual generative networks, Dash et al. (2022) incorporates a structural causal model (SCM) in a variant of Adversarially Learned Inference for generating counterfactual images.",,,0,not_related
"(2020) employ normalizing flows and variational inference for enabling tractable counterfactual inference, Sanchez & Tsaftaris (2022) use diffusion models for counterfactual estimation, Axel Sauer (2021) proposes counterfactual generative networks, Dash et al. (2022) incorporates a structural causal model (SCM) in a variant of Adversarially Learned Inference for generating counterfactual images. Normalizing flow-based methods for answering counterfactual queries has received a lot of attention in no time. For example, Pawlowski et al. (2020)’s work on healthy magnetic resonance images of the brain has been extended to account for the clinical and radiological phenotype of multiple sclerosis (MS) by Reinhold et al.",,,0,not_related
"(2020) employ normalizing flows and variational inference for enabling tractable counterfactual inference, Sanchez & Tsaftaris (2022) use diffusion models for counterfactual estimation, Axel Sauer (2021) proposes counterfactual generative networks, Dash et al. (2022) incorporates a structural causal model (SCM) in a variant of Adversarially Learned Inference for generating counterfactual images. Normalizing flow-based methods for answering counterfactual queries has received a lot of attention in no time. For example, Pawlowski et al. (2020)’s work on healthy magnetic resonance images of the brain has been extended to account for the clinical and radiological phenotype of multiple sclerosis (MS) by Reinhold et al. (2021). Wang et al. (2021) perform counterfactual inference to achieve harmonization of brain imaging data with different protocols and from different sites in a clinical study. From a deep learning perspective, an exogenous variable might be considered as an inferred latent variable. To infer the state of the latent noise attached to an endogenous variable, we typically model a normalizing flow, perform amortized variational inference (in the case of very high dimensional variables) (Pawlowski et al., 2020) or use deterministic forward diffusion(Sanchez & Tsaftaris, 2022). Our ability to infer a latent variable comes at a computational cost as well as a statistical cost. To illustrate, the framework for counterfactual estimation by inferring exogenous noises via normalising flows parameterizes each structural assignment of an SCM as an invertible mechanism. Each mechanism explicitly calculates its inverse to enable efficient abduction of exogenous noises. These invertible architectures are typically computationally heavy. For a description of normalizing flows, see Appendix A and Papamakarios et al. (2019). However, given an SCM, in practice, we are interested in counterfactual queries involving a few variables (not all)! For example, Reinhold et al.",,,0,not_related
"(2020) employ normalizing flows and variational inference for enabling tractable counterfactual inference, Sanchez & Tsaftaris (2022) use diffusion models for counterfactual estimation, Axel Sauer (2021) proposes counterfactual generative networks, Dash et al. (2022) incorporates a structural causal model (SCM) in a variant of Adversarially Learned Inference for generating counterfactual images. Normalizing flow-based methods for answering counterfactual queries has received a lot of attention in no time. For example, Pawlowski et al. (2020)’s work on healthy magnetic resonance images of the brain has been extended to account for the clinical and radiological phenotype of multiple sclerosis (MS) by Reinhold et al. (2021). Wang et al. (2021) perform counterfactual inference to achieve harmonization of brain imaging data with different protocols and from different sites in a clinical study. From a deep learning perspective, an exogenous variable might be considered as an inferred latent variable. To infer the state of the latent noise attached to an endogenous variable, we typically model a normalizing flow, perform amortized variational inference (in the case of very high dimensional variables) (Pawlowski et al., 2020) or use deterministic forward diffusion(Sanchez & Tsaftaris, 2022). Our ability to infer a latent variable comes at a computational cost as well as a statistical cost. To illustrate, the framework for counterfactual estimation by inferring exogenous noises via normalising flows parameterizes each structural assignment of an SCM as an invertible mechanism. Each mechanism explicitly calculates its inverse to enable efficient abduction of exogenous noises. These invertible architectures are typically computationally heavy. For a description of normalizing flows, see Appendix A and Papamakarios et al. (2019). However, given an SCM, in practice, we are interested in counterfactual queries involving a few variables (not all)! For example, Reinhold et al. (2021) studied what the brain image of the subject would look like if the subject did not have lesions, given the observation that they have a 60 mL lesion load.",,,0,not_related
FlexTENet[131] # ! # # SCP[132] # ! # # CGN[74] ! ! # # SyncTwin[101] # # ! #,,,1,related
"com/trends/explore?date=all&q=mnist [125, 198, 74, 199, 200, 201, 202, 203, 204] ADNI www.",,,1,related
", the methods considering representations of distribution balance[40, 42, 43], exploiting the effects of covariates confounding learning[53, 69, 70, 71], the methods based on generative adversarial networks[44, 72, 73, 74] , and so forth[57, 33, 75].",,,0,not_related
"com/usaito/counterfactual-cv CGN[74] MNIST,ImageNet Pytorch https://github.",,,1,related
"few studies along this line also generate counterfactual samples with neural networks (Sauer and Geiger, 2021; Yue et al., 2021).",,,0,not_related
"Thus far, state-of-the-art deep causal structure learning frameworks have been employed to model the data generation process of 2D images (Pawlowski et al., 2020; Vlontzos et al., 2022; Sauer and Geiger, 2021).",,,0,not_related
"…we also find that our approach offers the ability to effectively interpolate between OOD face images and more importantly, manipulate specific attributes of interest (e.g., non-smiling → smiling), thus validating its utility in semantic editing and counterfactual reasoning (Axel Sauer, 2021).",,,1,related
"Such data can be manipulated, interpolated or composed [12, 13, 28, 43, 44] with dedicated operators in their latent space, and further used for counterfactual reasoning [56, 65, 72, 92].",,,1,related
"Some works investigate intermediate GAN representations to construct part segmentation datasets [74, 75], while some treat pretrained GANs as black-box models and use them to augment data for robustness [76, 35] or ensembling [77].",,,0,not_related
"Examples include CausalGAN, CausalVAE, and counterfactual generative networks (Kocaoglu et al., 2017; Yang et al., 2021; Sauer & Geiger, 2021).",,,0,not_related
