text,label_score,label,target_predict,target_predict_label
"For example, in text classification, while standard models typically attend to salient (high gradient influence) words (Serrano and Smith, 2019a), recent work constructs accurate models that attend to irrelevant words instead (Wiegreffe and Pinter, 2019a; Pruthi et al., 2020).",,,0,not_related
"For example, Jain and Wallace (2019); Serrano and Smith (2019b); Wiegreffe and Pinter (2019b); Pruthi et al. (2020) all show that information flows across hidden states.",,,0,not_related
"However, recent work raises concerns about the interpretability of attention distributions [3], [12], [21], [24].",,,0,not_related
"Though ubiquitous, token scores may not always reflect their real importance (Pruthi et al., 2020).",,,0,not_related
"…to/from Human As for human consuming attention as explanation, there has been criticism that unsupervised attention weights are too poorly correlated with the contribution of each word for machine decision (or, unfaithful) (Jain and Wallace, 2019; Serrano and Smith, 2019; Pruthi et al., 2019).",,,0,not_related
"tion of each word for machine decision (or, unfaithful) (Jain and Wallace, 2019; Serrano and Smith, 2019; Pruthi et al., 2019).",,,0,not_related
"Conversational Question Answering (ConvQA) is a new question answering task that requires a comprehension of the context, which has recently received more and more attention (Zhu et al., 2018; Qu et al., 2019a; Qu et al., 2019b; Meng et al., 2019; Pruthi et al., 2020).",,,0,not_related
"The robustness of explanations is studied in [1, 10, 30, 44, 48], but none of them is for Shapley values on MRF.",,,0,not_related
"The above answer to the T-Contrast questions can be used to study the robustness of Shapley values when the input MRF is (adversarially) perturbed, a situation that has been studied for other explanations in [1, 10, 30, 44, 48].",,,0,not_related
2017) models in an attempt to make it more interpretable (Pruthi et al. 2020; Brunner et al. 2020).,,,0,not_related
"…for NLP models have focused on explaining individual predictions by using gradient-based saliency maps over the input text (Lei, Barzilay, and Jaakkola 2016; Ribeiro, Singh, and Guestrin 2018; Bastings, Aziz, and Titov 2019) or interpreting attention (Brunner et al. 2020; Pruthi et al. 2020).",,,0,not_related
"Prior interpretability techniques for NLP models have focused on explaining individual predictions by using gradient-based saliency maps over the input text (Lei, Barzilay, and Jaakkola 2016; Ribeiro, Singh, and Guestrin 2018; Bastings, Aziz, and Titov 2019) or interpreting attention (Brunner et al. 2020; Pruthi et al. 2020).",,,0,not_related
Recent work has manipulated attention in Transformer (Vaswani et al. 2017) models in an attempt to make it more interpretable (Pruthi et al. 2020; Brunner et al. 2020).,,,0,not_related
"This complete reliance on attention mechanism is problematic as the MFN assumes synchronous inputs which is hard to achieve in real-world scenarios, and more importantly, the reliability of attentionmemory to discover inter-modal interactions is questionable as shown with deceptive attention masks in [7].",,,0,not_related
"Their complete reliance on attention scheme is problematic due to two reasons: 1) they have deceptive attention masks (in MFN), and hence it is obscure whether the gain in prediction is attributable to inter-modal interactions [7] and, 2) the role of training dynamics (in MARN) instead of multiple-heads [8].",,,0,not_related
"Pruthi et al. (2020) manipulate attention distributions in
an end-to-end fashion; we focus on manipulating gradients.",,,1,related
"This metric estimates the extent to which the model is attributing its predictions to gender (an unbiased model should have less of this attribution), and is similar to the measure of bias used by Pruthi et al. (2020).",,,0,not_related
"For example, adversaries can control attention visualizations (Pruthi et al., 2020) or black-box explanations such as LIME (Ribeiro et al., 2016; Slack et al., 2020).",,,0,not_related
"A.4 Biosbias Details
We follow the setup of Pruthi et al. (2020) and only use examples with the labels of “physician” and “surgeon”.",,,1,related
"For example, adversaries can control attention visualizations (Pruthi et al., 2020) or black-box explanations such as LIME (Ribeiro et al.",,,0,not_related
"Finally, Pruthi et al. (2020) propose a method to produce deceptive attention weights.",,,0,not_related
"But these weights do not reliably correlate with model predictions, making them unsuitable for explainability (Pruthi et al., 2020; Serrano and Smith, 2019; Jain and Wallace, 2019).",,,0,not_related
"Depending on the task and model architecture, attention may have more or less explanatory power for model predictions [35, 51, 57, 71, 79].",,,0,not_related
"Recent work on the faithfulness of attention heat-maps (Baan et al., 2019; Pruthi et al., 2019; Jain and Wallace, 2019; Serrano and Smith, 2019; Wiegreffe and Pinter, 2019) or saliency distributions (AlvarezMelis and Jaakkola, 2018; Kindermans et al., 2019) cast doubt on their faithfulness as…",,,0,not_related
"The work of Pruthi et al. (2019) emphasizes the threat of interpreting models through attention weights, as they show a regularization term can be introduced to guide the attention weights away from focusing on subsets of words while retaining model accuracy, implying that models which exploit bias…",,,0,not_related
"However, the above formulation (referred in literature as “Luong attention”) is most widely used in text classification tasks (Jain and Wallace, 2019; Wiegreffe and Pinter, 2019; Pruthi et al., 2020).",,,0,not_related
"Recently, Pruthi et al. (2020) conjecture that attention offers benefits during training; our work explains, and provides empirical evidence to support the speculation.",,,0,not_related
"Although it is wrong to equate attention with explanation (Pruthi et al., 2019; Jain and Wallace, 2019), it can offer plausible and meaningful interpretations (Wiegreffe and Pinter, 2019; Vashishth et al., 2019; Vig, 2019).",,,0,not_related
"Although it is wrong to equate attention with explanation (Pruthi et al., 2019; Jain and Wallace, 2019), it can offer plausible and meaningful interpretations (Wiegreffe and Pinter, 2019; Vashishth et al.",,,0,not_related
"For example, without faithful explanations, we cannot know whether a model is exploiting sensitive features such as gender (Pruthi et al., 2020).",,,1,related
"In pa ticular, existing feature attributio methods m y n t provide robust, faithful explanations (Feng et al., 2018; Jain and Wallace, 2019; Wiegreffe and Pinter, 2019; Serrano and Smith, 2019; Brunner et al., 2020; Zhong et al., 2019; Pruthi et al., 2020).",,,0,not_related
"the models (Jain and Wallace, 2019; Serrano and Smith, 2019; Wiegreffe and Pinter, 2019; Pruthi et al., 2020; Vashishth et al., 2019).",,,0,not_related
"Thus, it is more similar to attention as an explanation (Serrano and Smith, 2019; Jain and Wallace, 2019; Pruthi et al., 2019), where the attention structure does not necessarily reveal what tokens are used for prediction.",,,0,not_related
"Recent work (Brunner et al., 2020; Pruthi et al., 2019) has raised concerns about the interpretability of attention maps as representative of global context aggregation.",,,0,not_related
"The ability of attention distributions to provide explanations has been the target of a number of studies (Wiegreffe and Pinter, 2019; Serrano and Smith, 2019; Pruthi et al., 2019).",,,0,not_related
"6 HTA: Local Validation The ability of attention distributions to provide explanations has been the target of a number of studies (Wiegreffe and Pinter, 2019; Serrano and Smith, 2019; Pruthi et al., 2019).",,,0,not_related
"Pruthi et al. (2019) show that, just as in other attention models, it is possible to manipulate self-attention in transformers in order to generate different attention masks that cause only a small drop in performance.",,,0,not_related
"However, recent studies (Brunner et al., 2020; Pruthi et al., 2019) question the ability of attention maps to provide a faithful explanation of the inner workings of transformer models.",,,0,not_related
"Whether for attention (Baan et al., 2019; Pruthi et al., 2019; Jain and Wallace, 2019; Serrano and Smith, 2019; Wiegreffe and Pinter, 2019), saliency methods (Alvarez-Melis and Jaakkola, 2018; Kindermans et al.",,,0,not_related
"…the following challenge to the community: We must develop formal definition and evaluation for faith-
9Whether for attention (Baan et al., 2019; Pruthi et al., 2019; Jain and Wallace, 2019; Serrano and Smith, 2019; Wiegreffe and Pinter, 2019), saliency methods (Alvarez-Melis and Jaakkola,…",,,1,related
"the models (Jain and Wallace, 2019; Serrano and Smith, 2019; Wiegreffe and Pinter, 2019; Pruthi et al., 2020; Vashishth et al., 2019).",,,0,not_related
"It has been actively discussed so far whether the attention weights can be interpreted to explain
the models (Jain and Wallace, 2019; Serrano and Smith, 2019; Wiegreffe and Pinter, 2019; Pruthi et al., 2020; Vashishth et al., 2019).",,,0,not_related
[22] examined how attention-based methods could be fooled.,,,0,not_related
"In other related work, Pruthi et al. (2019) show that one can easily learn to deceive using attention weights.",,,0,not_related
"However, attention weights do not in general provide faithful explanations for predictions (Jain and Wallace, 2019; Serrano and Smith, 2019; Wiegreffe and Pinter, 2019; Zhong et al., 2019; Pruthi et al., 2019; Brunner et al., 2019; Moradi et al., 2019; Vashishth et al., 2019).",,,0,not_related
"However, their reliability has been questioned (Jain and Wallace 2019; Pruthi et al. 2020).",,,0,not_related
"According to various studies (Jain and Wallace 2019; Serrano and Smith 2019; Pruthi et al. 2020), standard attention modules noisily predict input importance; the weights cannot provide safe and meaningful explanations.",,,0,not_related
"…state activation (Karpathy, Johnson, and Li 2015; Li et al. 2016; Montavon, Samek, and Müller 2018), attention weights (Jain and Wallace 2019; Serrano and Smith 2019; Pruthi et al. 2020), and learned sparse and interpretable word vectors (Faruqui et al. 2015b,a; Herbelot and Vecchi 2015).",,,0,not_related
"Moreover, (Pruthi et al. 2020) showed that standard attention modules can fool people into thinking that predictions from a model biased against gender minorities do not rely on the gender.",,,0,not_related
"2016; Montavon, Samek, and Müller 2018), attention weights (Jain and Wallace 2019; Serrano and Smith 2019; Pruthi et al. 2020), and learned sparse and interpretable word vectors (Faruqui et al.",,,0,not_related
"As it is proven possible to incorporate constraints on attention while maintaining satisfactory performance [25,12,31], we propose three approaches for enforcing plausibility constraints on attention maps, namely, sparsity regularization, semi-supervised learning, and supervised learning.",,,1,related
"Again, is TracIn intrinsic or posthoc?",,,1,related
"resentations [38], clustering [39, 40, 41], probing classifiers [16], concept activation [18], representer point selection [42], TracIn [43], and uptraining [44].",,,0,not_related
"For a real example, consider TracIn [43], in which influence functions are estimated across various training check points.",,,0,not_related
"2Examples of local methods include gradients [21, 22, 23], LRP [24], deep Taylor decomposition [25], integrated gradients [26, 27], DeepLift [28], direct interpretation of gate/attention weights [29], attention roll-out and flow [30], word association norms and analogies [31], time step dynamics [32], challenge datasets [33, 34, 35, 36], local uptraining [19], and influence sketching and influence functions [37]; examples of global methods include unstructured pruning, lottery tickets, dynamic sparse training, binary networks, sparse coding, gate and attention head pruning, correlation of representations [38], clustering [39, 40, 41], probing classifiers [16], concept activation [18], representer point selection [42], TracIn [43], and uptraining [44].
maintain.3 Moreover, for a method to be posthoc means different things to local and global methods.",,,0,not_related
"consider TracIn [43], in which influence functions are estimated across various training check points.",,,0,not_related
"In 538 fact, Pruthi et al. (2020) cast serious doubts on us- 539 ing attention maps as a way for users to audit expla- 540 nations in the context of fairness.",,,0,not_related
"While we believe these tools will eventually help stakeholders gain a deeper understanding of multimodal models as a step towards reliable real-world deployment, we believe that special care must be taken in the following regard to ensure that these interpretation tools are reliably deployed: Reliability of visualizations: There has been recent work examining the reliability of model interpretability methods for real-world practitioners [82, 94].",,,0,not_related
"[82] Danish Pruthi, Mansi Gupta, Bhuwan Dhingra, Graham Neubig, and Zachary C Lipton.",,,0,not_related
"Reliability of visualizations: There has been recent work examining the reliability of model interpretability methods for real-world practitioners [15, 53, 65, 82, 94].",,,0,not_related
", 2014) are widely used as an interpretability tool, but these attention maps are often unfaithful and unreliable (Jain and Wallace, 2019; Wiegreffe and Pinter, 2019; Zhong et al., 2019; Pruthi et al., 2020).",,,0,not_related
"Explainable NLP Heat maps generated from attention values from the models (Bahdanau et al., 2014) are widely used as an interpretability tool, but these attention maps are often unfaithful and unreliable (Jain and Wallace, 2019; Wiegreffe and Pinter, 2019; Zhong et al., 2019; Pruthi et al., 2020).",,,0,not_related
"Following the work, there have been a number of efforts to obtain both faithful and plausible explanations of Transformers using attention [61, 62].",,,0,not_related
"However, recent studies argued that attention cannot be used as a reliable tool to explain the behavior of models (Jain and Wallace, 2019; Pruthi et al., 2020; Bastings and Filippova, 2020).",,,0,not_related
34 The paper Learning to Deceive with Attention-Based Explanations [8] aims to prove that attention weights do not 35 convey true interpretability.,,,0,not_related
"These papers often provide results that either prove a32 correlation between the attention weights and predictions [11][10], or the ambiguity between attention weights and the33 performance of the rest of the model [6][7], or somewhere in between [9].34
The paper Learning to Deceive with Attention-Based Explanations [8] aims to prove that attention weights do not35 convey true interpretability.",,,0,not_related
[8] introduce a method for manipulating attention that penalizes the attention weights of impermissible 52 tokens.,,,0,not_related
In: arXiv preprint232 arXiv:2004.14243 (2020).233 [8] Danish Pruthi et al. “Learning to Deceive with Attention-Based Explanations”.,,,1,related
"[8] add a penalty R to the loss function that is used for the specific task, resulting in a total cost of 58 L′ = L+R.",,,1,related
Our results reproduce Pruthi et al. (2020)’s finding that models can learn to deceive.,,,1,related
"Our results reproduce Pruthi et al. (2020)’s finding that models can learn to deceive. Jain and Wallace (2019) note that for attention to be an explanation, a different configuration of attention weights for the same piece of text should lead to different predictions. The research which we have reproduced implies that the same accuracy (hence prediction) can be maintained while explicitly changing the configuration of attention weights. The implications are clear; either it is providing further evidence for why attention should not be thought of as an explanation, supporting Serrano and Smith (2019)’s findings that attention weights can be largely zeroed out without affecting accuracy.",,,0,not_related
Pruthi et al. (2020) challenge the usage of attention-based explanation through a series of experiments using classification and sequence-to-sequence (seq2seq) models.,,,0,not_related
"Acknowledging the debate, Pruthi et al. (2020) whose work we seek to reproduce, examine whether models can learn to deceive, by adding a penalty to the loss function that punishes the model when attention is paid to impermissible tokens.",,,1,related
Table 3: Classification results from Table 3 in Pruthi et al. (2020) with cell scheme author | reproduced for all models except BERT(HgFc) which follows cell scheme author | replicated.,,,1,related
Pruthi et al. (2020) argue that the accuracy of the Embedding and BiLSTM models could have been greatly impacted by the lambda parameter because those models might be under-parameterised for the SST-Wiki dataset.,,,0,not_related
Especially the reported mean accuracy by Pruthi et al. (2020) shows no significant difference to our reported values for all seq2seq tasks except for the baseline experiments with uniform and no attention for the tasks sequence copy and sequence reverse.,,,0,not_related
"Our results reproduce Pruthi et al. (2020)’s finding that models can learn to deceive. Jain and Wallace (2019) note that for attention to be an explanation, a different configuration of attention weights for the same piece of text should lead to different predictions.",,,1,related
"Pruthi et al. (2020) did not report accuracies for the translation task in their original paper, but they provided us with
additional raw data which also contained the accuracy scores from their experiments.",,,1,related
Seq2seq Pruthi et al. (2020) provide a bidirectional and unidirectional Gated Recurrent Unit (GRU) with dot-product attention respectively for their encoder-decoder model tackling seq2seq tasks.,,,1,related
"In this reproducibility report we run four classification tasks and four sequence-to-sequence tasks to test the claims made by Pruthi et al.. For the classification experiments, three attention-based models are trained and evaluated on four classification tasks. The four classification experiments consist out of three binary classification task and one multiclass classification task. For the sequence-to-sequence experiments, an encoder-decoder model with varying attention mechanisms is trained and evaluated on four tasks. Three of these tasks are toy datasets created by Pruthi et al., the fourth task is an English to German machine translation task (More information in section 3). Further on in the report, we display the results obtained by conducting these experiments and compare them to the results reported by Pruthi et al. (Section 4 & 5). We cannot reproduce one of the binary classification tasks from the paper of Pruthi et al., because they do not have permission to share this private dataset. Therefore, we substitute this dataset for a multiclass classification dataset. As Wiegreffe and Pinter (2019) state, complex networks can produce outputs which can easily be aggregated to form the same binary prediction.",,,1,related
"However, Pruthi et al. (2019) show that the attention weights can easily be manipulated during training without a significant change in performance.",,,0,not_related
Sentiment Analysis + Wikipedia sentences Pruthi et al. used the binary version of the Stanford Sentiment Treebank Socher et al. (2013). Pruthi et al.,,,1,related
"First, different evaluation methods may give rise to contradictory conclusions, which has caused many debates, such as the argument in using the magnitudes of attention weights as interpretations for transformer-based models (Wiegreffe and Pinter, 2019; Jain and Wallace, 2019; Pruthi et al., 2019; Bastings and Filippova, 2020) and the rebuttal of gradient-based methods (Alvarez-Melis and Jaakkola, 2018; Ghorbani et al.",,,0,not_related
"…in using the magnitudes of attention weights as interpretations for transformer-based models (Wiegreffe and Pinter, 2019; Jain and Wallace, 2019; Pruthi et al., 2019; Bastings and Filippova, 2020) and the rebuttal of gradient-based methods (Alvarez-Melis and Jaakkola, 2018; Ghorbani et al.,…",,,0,not_related
"At the same time, these interpretation methods have received much scrutiny, arguing that the interpretations are fragile or unreliable (Alvarez-Melis and Jaakkola, 2018; Pruthi et al., 2019; Wang et al., 2020; Slack et al., 2020).",,,0,not_related
"At the same time, these interpretation methods have received much scrutiny, arguing that the interpretations are fragile or unreliable (Alvarez-Melis and
Jaakkola, 2018; Pruthi et al., 2019; Wang et al., 2020; Slack et al., 2020).",,,0,not_related
"However their contributions like training with an auxilary atomic-task supervi-
sion for improved faithfulness are specific to the context of NMNs. Pruthi et al. (2020) demonstrate that it is possible to train a model that produces a deceptive attention mask, questioning the use of attention…",,,0,not_related
"However their contributions like training with an auxilary atomic-task supervi-
sion for improved faithfulness are specific to the context of NMNs. Pruthi et al. (2020) demonstrate that it is possible to train a model that produces a deceptive attention mask, questioning the use of attention weights as explanation from the fairness and accountability perspective.",,,0,not_related
"We use unweighted average recall (UAR) as our evaluation metric for the emotion classification to account for class imbalance (Rosenberg, 2012).",,,1,related
"As shown in [10], the MHA is at least partly interpretable even though multiple heads can be pruned without reducing the accuracy [15].",,,0,not_related
"Inspecting the attention scores is a common method of explaining a model’s prediction that has been called into question in recent years [19,26].",,,0,not_related
"[13] Isaac Lage, Emily Chen, Jeffrey He, Menaka Narayanan, Been Kim, Sam Gershman, and Finale Doshi-Velez.",,,0,not_related
"Thus to restrict the model to only consider some specific alignments, we intuitively mask co-attention matrices AP and AH following Serrano and Smith (2019); Pruthi et al. (2020).",,,1,related
Authors have exploited these vulnerabilities to make discriminatory models pass algorithmic audits [18] and appear fair in user studies [13].,,,0,not_related
"[7], Jain and Wallace [8] illustrated that there are limitations in using attentions as explanations, in terms of being incapable to provide fully faithful explanations concerning the model decisions.",,,0,not_related
"Moreover, Pruthi et al. (2019) demonstrates how easy it is to manipulate the Attention weights.",,,0,not_related
"…it has been reported that learned attention weights are often uncorrelated with the word importance calculated through the gradientbased method (Simonyan et al., 2013), and perturbations to the attention mechanisms may interfere with interpretation (Jain and Wallace, 2019; Pruthi et al., 2019).",,,0,not_related
", 2013), and perturbations to the attention mechanisms may interfere with interpretation (Jain and Wallace, 2019; Pruthi et al., 2019).",,,0,not_related
"However, different layers vary in their behaviors [23, 24], and it has been shown that attention alone can be deceiving when used for interpretability and explanation [25].",,,0,not_related
"[50] demonstrate that it is possible to train a model that produces a deceptive attention mask, questioning the use of attention weights as explanation from the fairness and accountability perspective.",,,0,not_related
