text,label_score,label,target_predict,target_predict_label
[19] demonstrate the manipulability of attention-based explanations and Wang et al.,,,0,not_related
These approaches involve recording the self-attention maps generated by the self-attention heads of the last block in the ViT model during inference.,,,0,not_related
"Despite these advancements, there are few contributions exploring the explainability of the ViT series of models.",,,0,not_related
"B. ViT Explainability
Currently, there remain few studies focusing on the explainability of methods belonging to the ViT family.",,,0,not_related
"First, we extract tLS from ViT.",,,1,related
"This approach consists of two main parts: generating alternative activation maps M and calculating the class-aware weighting scores w to extract class-aware patch tokens tc.
Generating alternative activation maps M : As discussed in III-A, ViT utilizes discrete tokens to convey information.",,,0,not_related
V iT (·) denotes the output vector of the ViT model.,,,1,related
"Most existing approaches only consider the direct use of the raw-attention map corresponding to the class token in the multi-head self-attention (MHSA) module to directly generate explainability maps in ViT [22], [23], [24].",,,0,not_related
"Some approaches have been proposed to generate explainability maps directly from the raw-attention map corresponding to the cls-token [22], [23], [24].",,,0,not_related
"We firstly generate the patch tokens tLS by removing the last layer class token tLcls from the output of the last layer normalization
4 ⋯ Transform er layers ⋯ ⋮
ViT•
⋯
s
⋯
“zebra” “elephant”
C classes
M
𝒕𝒕𝑺𝑺𝑳𝑳
P
G
w
ViT(X)
ViT(P)
X
⋯
Projection+ Position em
bedding
Reshape normalization
Hadamard product
Cosine similarity
×
Columnwise
Generate graph
Graph cut
𝒕𝒕𝒄𝒄
R-Out
Cut
ViT Share weights
Upsampling
Fig.",,,1,related
"To compute the weight scores w for each perturbation map Pi, we input both the perturbation map matrix P and the original image X into the pre-trained ViT model.",,,1,related
"In the Vision Transformer (ViT) architecture, each transformer block follows a specific arrangement of components.",,,0,not_related
"2) Implementation Details: In our experiments, we used the same pre-trained ViT-base model as the backbone for our explainability maps tests to ensure fairness.",,,1,related
"This type of explainability is particularly relevant for models with complex structures, such as Convolutional Neural Networks (CNNs) [6], [7], [8], [9], [10] and Vision Transformers (ViTs) [11], [12], [13], [14], [15], [16].",,,0,not_related
", raw-attention [22], [23], [24], rollout[25], grad-cam[30], and Hila’s method[26].",,,0,not_related
The emergence of Vision Transformers (ViTs) has revolutionized computer vision.,,,0,not_related
"A. Vision transformer (ViT)
The ViT model is a popular approach for image classification tasks that uses a transformer-based architecture.",,,0,not_related
"This sensitivity makes them susceptible to manipulations designed to hide the use of problematic features in the AI decision-making and deceive the human overseeing the system [7, 11, 28, 65, 92].",,,0,not_related
"However, using information from raw attention poses limitations to the complete use of the structural characteristics of vision transformers, which include multiple learning modules [24].",,,0,not_related
"(Jain and Wallace, 2019; Serrano and Smith, 2019; Pruthi et al., 2020), and on applying gradient-based methods (Li et al.",,,0,not_related
"This line of research includes a large body of work focusing on the analysis of the attention mechanism
(Jain and Wallace, 2019; Serrano and Smith, 2019; Pruthi et al., 2020), and on applying gradient-based methods (Li et al., 2016a; Sundararajan et al., 2017) to obtain input attribution scores.",,,0,not_related
"In doing so, we avoid the non-identifiability problem of transformer models (Pruthi et al., 2019).",,,1,related
"In spite of a number of supporters initially for this approach, there has been a recent wave of detractors of attentionbased explanations (Jain and Wallace, 2019; Pruthi et al., 2019; Serrano and Smith, 2019).",,,0,not_related
"Because we are factorizing h, we can generate explanations on embeddings without needing to deal with the complexities of attention layers (Pruthi et al., 2019); nor do we have to deal with the nonidentifiability of transformer models (Brunner et al.",,,1,related
"Recent debates have shown that attention maps and attribution methods are unreliable (Pruthi et al., 2019; Brunner et al., 2019).",,,0,not_related
"can be deceivable, determining the importance of the output only based on attention weights is not explainable [4].",,,0,not_related
"However, recent studies [14, 30, 42] showed that attention is not an explanation.",,,0,not_related
"Past work has used attention weights as a mechanism of providing explanations, but it has been observed that such explanations may not always be faithful to predictions [12, 17, 41].",,,0,not_related
"For example, using attention mechanisms may highlight associations entirely unrelated to a model’s output [44].",,,0,not_related
[28] use explanation-supervised models to substitute human participants in artificial simulatability studies to assess the quality of explanations.,,,0,not_related
"Recently, there has been promising progress on the topic of explanation supervision in the domains of image processing [19,29,2] and natural language processing [10,28,37].",,,0,not_related
The use of attention weights for explaining NLP models has been extensively debated and the general conclusion seems to point to the negative side (Jain and Wallace 2019; Serrano and Smith 2019; Pruthi et al. 2020; Bastings and Filippova 2020).,,,0,not_related
"Incorporating prior knowledge through selective attention is widely explored in natural language processing, especially in
recent NLP models with attention mechanism (Lin et al., 2016; Sukhbaatar et al., 2019; Pruthi et al., 2020; Beltagy et al., 2020; Wang et al., 2022).",,,0,not_related
"all modalities and textual data in particular (Pruthi et al., 2020; Ribeiro et al., 2016; Lundberg and Lee, 2017).",,,0,not_related
"ExAI is witnessing endeavors in
Papers accepted at Findings of Empirical Methods in Natural Language Processing (EMNLP), 2022.
all modalities and textual data in particular (Pruthi et al., 2020; Ribeiro et al., 2016; Lundberg and Lee, 2017).",,,0,not_related
", 2014) are widely used as an interpretability tool, but these attention maps are often unfaithful and unreliable (Jain and Wallace, 2019; Wiegreffe and Pinter, 2019; Zhong et al., 2019; Pruthi et al., 2020).",,,0,not_related
"Explainable NLP Heat maps generated from attention values from the models (Bahdanau et al., 2014) are widely used as an interpretability tool, but these attention maps are often unfaithful and unreliable (Jain and Wallace, 2019; Wiegreffe and Pinter, 2019; Zhong et al., 2019; Pruthi et al., 2020).",,,0,not_related
"While our study design does not explicitly account for this, even if perceptions vary at the instance level, our findings suggest that reliance would depend on the inclusion of sensitive features, which research has shown to be an unreliable signal for assessing algorithmic fairness [4, 26, 50, 54, 67, 73, 79].",,,0,not_related
", through adversarial attacks on explanation methods [24, 54, 79, 95].",,,0,not_related
", the exclusion of information that is evidently indicative of a person’s demographics, is neither necessary nor sufficient for an algorithm to be procedurally fair [54, 67, 79] or to not display bias in terms of distributive fairness [4, 26, 50, 73].",,,0,not_related
"Pruthi et al. (2020) again refutes argument (b), showing that with a simple training objective, they successfully guide the model to learn intended adversarial attention
distributions.",,,0,not_related
"For example, Pruthi et al. (2020) show that it is possible to attention weights can be a deceiving explanation to end-users.",,,0,not_related
"This suggests that although attention signifies the importance of the input modalities, it alone may not be enough for predicting DTAs or potential mechanism of action [36], [37].",,,0,not_related
", 2018, 2019), a lot of work questions attention explainability (Wiegreffe and Pinter, 2019; Jain and Wallace, 2019; Serrano and Smith, 2019; Bastings and Filippova, 2020; Pruthi et al., 2020).",,,0,not_related
"…is not reliable: although there is evidence that attention can play recognizable roles (Voita et al., 2018, 2019), a lot of work questions attention explainability (Wiegreffe and Pinter, 2019; Jain and Wallace, 2019; Serrano and Smith, 2019; Bastings and Filippova, 2020; Pruthi et al., 2020).",,,0,not_related
[83] manipulate the attention weights to whitewash problematic tokens in explanations that afect the model fairness or accountability.,,,0,not_related
"[91] (2015) Weights visualization on recognizing textual entailement X Dominance of the last output vector over attention in some cases [27] (2017) Layer-wise relevance propagation (LRP) [6] X Importance of LRP to further interpret the attention weights and the internal workings of transformers [116] (2019) Alignment between syntactic dependency and attention through visualization and aggregation X (1) Disproportionality between heads targeting POS, (2) Capturing of longer-distance relationships by deeper layers and (3) Moderate correlation between distance and entropy of attention [47] (2019) Correlation and counterfactuals X No frequent correlation between attention weights and gradient-based measures of feature importance [13] (2019) Aggregation of context into hidden tokens X Preservation of the token identiiability throughout the model and decrease of information identiiability with depth [83] (2020) Diminishing attention weights of impermissible tokens X Attention-based explanations can be deceived especially within the fairness context",,,0,not_related
"However, attention is only a small part of the overall computation and can be easily manipulated to hide model biases [56].",,,0,not_related
"Reliability of visualizations: There has been recent work examining the reliability of model interpretability methods for real-world practitioners (Pruthi et al., 2020; Srinivas and Fleuret, 2020).",,,0,not_related
"Although its use as an interpretability method has been criticized (Jain and Wallace 2019; Serrano and Smith 2019; Pruthi et al. 2020), using also the Euclidean norms of the vectors computed across each attention head (Kobayashi et al. 2020), the attention vector-norms method from now on, has been…",,,0,not_related
"Although its use as an interpretability method has been criticized (Jain and Wallace 2019; Serrano and Smith 2019; Pruthi et al. 2020), using also the Euclidean norms of the vectors computed across each attention head (Kobayashi et al.",,,0,not_related
"Lastly, our approach provides some quantitative argument for the validity of attention-based studies (Serrano and Smith, 2019; Jain and Wallace, 2019; Wiegreffe and Pinter, 2019; Pruthi et al., 2020) and expands on earlier works looking beyond attention weights (Kobayashi et al.",,,0,not_related
"Attention-based DNNs are growing in popularity [6, 37] with attention weights being used as explanations; however, recent works [29, 47, 45] show the limitations of such explanations.",,,0,not_related
"[32] apply a masked strategy for “deceiving”, which improves the attention’s reliability.",,,0,not_related
"Explanations can be misleading Deriving conclusions from existing findings is further complicated by evidence that explanations can mislead people’s beliefs [6, 25, 33], even in cases where there is no intention to manipulate [12].",,,0,not_related
[33] manipulate attention-based explanations such that people can be deceived into thinking that a model does not rely on sensitive information (e.,,,0,not_related
"While there have been recent advances in explaining neural network predictions [98], researchers have also demonstrated the ability to fool attention-based interpretation techniques [144].",,,0,not_related
"erefore, we set penalties to suppress the corresponding attention weight [29].",,,1,related
"But there is an ongoing debate “Is attention interpretable"" (Pruthi et al., 2020; Serrano and Smith, 2019; Jain and Wallace, 2019; Wiegreffe and Pinter, 2019; Vashishth et al., 2019).",,,0,not_related
"A prominent line of research has investigated the faithfulness of attention weights (Jain and Wallace, 2019; Serrano and Smith, 2019; Pruthi et al., 2020; Wiegreffe and Pinter, 2019; Madsen et al., 2021b) with contradictory conclusions.",,,0,not_related
"While the aforementioned work modified attention weights in a post-hoc manner after a model was trained, Pruthi et al. (2020) proposed to modify attention weights during model learning and produced models whose actual weights could lead to deceived interpretations. Wiegreffe and Pinter (2019) argued the validity of the claim in prior work (Jain and Wallace 2019) and proposed alternative experimental design to test when/whether attention can be used as explanation.",,,0,not_related
"While the aforementioned work modified attention weights in a post-hoc manner after a model was trained, Pruthi et al. (2020) proposed to modify attention weights during model learning and produced models whose actual weights could lead to deceived interpretations.",,,0,not_related
"Attention-based methods try to understand the network logic behind the Transformer-based models mainly from analyzing their self-attention maps [11], [43].",,,0,not_related
"Inspecting the attention scores is a common method of explaining a model’s prediction that has been called into question in recent years (Pruthi et al., 2020; Serrano and Smith,
2019).",,,0,not_related
"Inspecting the attention scores is a common method of explaining a model’s prediction that has been called into question in recent years (Pruthi et al., 2020; Serrano and Smith, 2019).",,,0,not_related
"Explanation robustness and sensitivity are two desired properties and have been mostly studied on images [1], [11], [55], [48], [34] and texts [34], but none on graphs.",,,0,not_related
"Similarly, other work has shown that it is possible to systematically manipulate attention while still retaining the same prediction [30].",,,0,not_related
"In addition, recent works [7, 20, 35, 38, 44] also find that the same prediction on an input could be generated by totally different attentions, which limits its applicability to explaining neural predictions.",,,0,not_related
"Recent methods for explaining predictions made by deep learning models considered explanations computed through convolutional layers [3, 26, 27, 33] (in vision models), and Transformer based architectures [11, 16, 17, 30, 37, 37, 40, 43] (in NLP models).",,,0,not_related
"While the authors in [18] argue that attention scores sometimes does not interpret model predictions faithfully, other works show that attention scores do offer plausible and meaningful interpretations that are often sufficient and correct [30, 39, 43].",,,0,not_related
"We notice that the use of attention weights for interpretability is a contentious topic in the literature [17, 32, 47].",,,0,not_related
"There has been a growing debate on the question of whether attention is interpretable [164, 143, 86, 203, 193, 30].",,,0,not_related
"[164, 143, 86, 30] hold negative attitude towards attention’s interpretability.",,,0,not_related
"In the NLP literature, the faithfulness of attention is regularly debated (Jain and Wallace, 2019; Wiegreffe and Pinter, 2019; Vashishth et al., 2019; Serrano and Smith, 2019; Pruthi et al., 2020), often with contradicting conclusions.",,,0,not_related
"Much recent work in NLP has been devoted to investigating the faithfulness of attention as an interpretability method (Jain and Wallace, 2019; Wiegreffe and Pinter, 2019; Vashishth et al., 2019; Serrano and Smith, 2019; Pruthi et al., 2020; Meister et al., 2021).",,,0,not_related
Pruthi et al. (2020) perform a similar analysis but report a contradictory finding.,,,0,not_related
"In Pruthi et al. (2020), the authors found that attention scores can be manipulated to deceive human decision makers.",,,0,not_related
"Following Pruthi et al. (2020), we use the biographies (DeArteaga et al., 2019) to predict whether the occupation is a surgeon or physician (non-surgeon).",,,1,related
Pruthi et al. (2020) also provides a pre-specified list of impermissible tokens 6 that a robust model should assign low attention scores to.,,,0,not_related
Pruthi et al. (2020) derived an occupation dataset to study the gender bias in NLP classification tasks.,,,0,not_related
even though multiple heads can be pruned without reducing the accuracy [21].,,,0,not_related
[21] showed how attention heads can be pruned; we follow up with an even bigger reduction in attention but show that key elements can still be preserved.,,,0,not_related
"This could also be further underlined by the findings and hypotheses of [4], [8], [11], [21].",,,0,not_related
instead of relying on the attention mechanism [27].,,,0,not_related
"As attention is not guaranteed to reflect how important a modality is [27], we guide the modality attention to be similar to human perceived modality informativeness and also evaluate how similar the predicted modality attention is to the perceived modality informativeness.",,,0,not_related
"of attention visualization may be limited in explaining particular predictions, depending on the task, attention can be quite useful in explaining the model’s overall predictions [39, 40, 41].",,,0,not_related
"Some works have criticized the use of attention weights as model explanations (Jain and Wallace, 2019; Serrano and Smith, 2019; Pruthi et al., 2020), demonstrating that attention weights distributions can be modified without affecting the final prediction.",,,0,not_related
"…have typically been used as a tool for evaluating explanation faithfulness generated by attention (Kennedy et al., 2020; Wiegreffe and Pinter, 2019; Pruthi et al., 2020; Ghorbani et al., 2019) while others used auxiliary objectives to improve the faithfulness of explanations generated by…",,,0,not_related
"typically been used as a tool for evaluating explanation faithfulness generated by attention (Kennedy et al., 2020; Wiegreffe and Pinter, 2019; Pruthi et al., 2020; Ghorbani et al., 2019) while others used auxiliary objectives to improve the faithful-",,,0,not_related
Pruthi et al. (2020) show similar outcomes by manipulating attention to attend to uninformative tokens.,,,0,not_related
"The functionally-groundedness of input feature explanations have recived a lot of attention and discussion, however there is still little consensus on what is functionally-grounded or how to even measure it [3, 11, 54, 60, 73, 76, 89, 106, 122, 130].",,,0,not_related
"On the other hand, there are also dissenting papers showing that attention weights are not (or only weakly) correlated with feature importance measures such as gradientbased methods [26, 55], and that there exist alternative “counterfactual” attention distributions that yield equivalent model predictions [26, 44, 50, 22].",,,0,not_related
"MFN is highly relied on attention mechanism, whose effect improvement is limited until the mask method is proposed [16].",,,0,not_related
"Model interpretability for NLP has been intensively studied in the past few years (Ribeiro et al., 2016; Alvarez-Melis and Jaakkola, 2018; Jacovi et al., 2018; Chen et al., 2020a; Jacovi and Goldberg, 2020; DeYoung et al., 2020; Pruthi et al., 2020; Ye et al., 2021).",,,0,not_related
…Grimsley et al. (2020) found evidence that causal explanations are not attainable from attention layers over text data; Jacovi and Goldberg (2020) explored the faithfulness of attention heatmaps; Pruthi et al. (2020) showed that attention masks can be trained to give deceptive explanations.,,,0,not_related
"…al. (2020) have described the potential for human attention supervision to address the validity of attention as a faithful, human-like explanation for model decisions while Pruthi et al. (2019) have discussed the potential for deception by manipulating attention to make models appear less biased.",,,0,not_related
"[1, 30, 61, 70, 84]) and determining when attention can be used as an explanation [84].",,,0,not_related
"inherent uncertainty [1], [19], [27], [49].",,,0,not_related
"However, humans find it hard to make sense of soft masks and instead prefer sparse binary masks or hard masks [1], [19], [27], [49].",,,0,not_related
"And we follow the (Pruthi et al. 2020) to carve out a binary classification task of distinguishing between surgeons and (non-surgeon) physicians, where a majority of surgeons (> 80%) in the dataset are male.",,,1,related
"To enhance the gender bias, (Pruthi et al. 2020) further downsample minority classes — female surgeons, and male physicians by a factor of ten.",,,0,not_related
"Model Architecture We train a simple embedding attention model (Pruthi et al. 2020), where the attention is directly over word embeddings (128 dimensions).",,,1,related
"And we follow the (Pruthi et al. 2020) to carve out a binary classification task of distinguishing between surgeons and (non-surgeon) physicians, where a majority of surgeons (> 80",,,1,related
"Attention-based interpretation can also be unreliable and manipulable to the point of deceiving practitioners, as Pruthi et al. (2020) and Jain and Wallace (2019) show.",,,0,not_related
", 2015) model the selection using a conditional importance distribution over the inputs, but the resulting explanations are noisy (Jain and Wallace, 2019; Pruthi et al., 2020).",,,0,not_related
"Attention mechanisms (Bahdanau et al., 2015) model the selection using a conditional importance distribution over the inputs, but the resulting explanations are noisy (Jain and Wallace, 2019; Pruthi et al., 2020).",,,0,not_related
"While removing the attention score normalization via softmax is not in line with an intuitive interpretation of attention as distributing “fractions” of an overall attention budget among inputs, a growing body of work shows that the attention weights distribution does not directly correlate with predictions (Jain & Wallace, 2019; Pruthi et al., 2020; Brunner et al., 2020).",,,0,not_related
"…with an intuitive interpretation of attention as distributing “fractions” of an overall attention budget among inputs, a growing body of work shows that the attention weights distribution does not directly correlate with predictions (Jain & Wallace, 2019; Pruthi et al., 2020; Brunner et al., 2020).",,,0,not_related
", 2020) and is faithful to the underlying computation, providing benefits even when omitted during inference (Pruthi et al., 2020).",,,0,not_related
"…since the attention mechanism (Bahdanau et al., 2015) provides plausible insight into what tokens the model considers relevant for a prediction (Galassi et al., 2020) and is faithful to the underlying computation, providing benefits even when omitted during inference (Pruthi et al., 2020).",,,0,not_related
Pruthi et al. (2020) also investigate the ability of attention weights to provide plausible explanations.,,,0,not_related
"Past studies proposed various, and sometimes conflicting, criteria for such interpretation [17, 25, 35], but their correctness is unclear.",,,0,not_related
"Due to its powerful ability, the attentionmechanism has been widely used in various neural network based applications such as language understanding tasks [11],[28], computer vision problems [32],[17].",,,0,not_related
"However, learned attention weights are often uncorrelated with word importance, which is calculated using the gradient-based method [14], and perturbations to the attention mechanisms may interfere with the interpretation [10, 28].",,,0,not_related
"Also, Baan et al. showed that MHA is at least partly interpretable even though multiple heads can be pruned without reducing the accuracy (Pruthi et al. 2019).",,,0,not_related
showed that MHA is at least partly interpretable even though multiple heads can be pruned without reducing the accuracy (Pruthi et al. 2019).,,,0,not_related
"2018), for inducing trustworthiness (Heuer and Breiter 2020) and have also explored the possibility of false privacy guarantees (Pruthi et al. 2019).",,,0,not_related
"Researchers have previously investigated the utility of explanations for various stakeholders (Preece et al. 2018), for inducing trustworthiness (Heuer and Breiter 2020) and have also explored the possibility of false privacy guarantees (Pruthi et al. 2019).",,,0,not_related
"This discussion has continued in the interpretable ML literature, with methods demonstrating how attention mechanisms can be useful or deceptive (Zhong et al., 2019; Grimsley et al., 2020; Jain et al., 2020; Pruthi et al., 2020).",,,0,not_related
"…research, and although there exist important concerns about the interpretability of attention distributions in transformers (Brunner et al., 2019; Pruthi et al., 2020), methods based on gradient attribution (Pascual et al., 2020) or on attention flow (Abnar and Zuidema, 2020) can provide…",,,0,not_related
"cerns about the interpretability of attention distributions in transformers (Brunner et al., 2019; Pruthi et al., 2020), methods based on gradient attribution (Pascual et al.",,,0,not_related
"However, it remains uncertain whether attention weights can provide reliable insights into the decision process of the model (Jain and Wallace, 2019; Wiegreffe and Pinter, 2019; Pruthi et al., 2020b).",,,0,not_related
"However, such interpretations were shown to be unreliable (Serrano and Smith, 2019; Pruthi et al., 2020) and unfaithful (Jain and Wallace, 2019; Wiegreffe and Pinter, 2019).",,,0,not_related
