text,label_score,label,target_predict,target_predict_label
"Substantial efforts are often required to adapt one visualization approach to various tasks (e.g., image caption) with different model backbones (e.g., Transformer backbone) or input formats (e.g., sequence of items).",,,0,not_related
"Because the proposed PAMI framework can consider the
well-trained model as a black-box, it can potentially work for various backbone structures (e.g., both CNN and Transformer backbones).",,,0,not_related
"In contrast, the majority of interpretation methods were proposed for the CNN backbone, and specific modifications are often required when applying existing interpretation methods (e.g., CAM or Grad-CAM) to other backbones like Transformer [9, 36] and graph neural networks [3, 12, 55].",,,0,not_related
"[9] Hila Chefer, Shir Gur, and Lior Wolf.",,,0,not_related
"In Figure 8, we further conduct visualization experiments(Chefer, Gur, and Wolf 2021) to show the effectiveness of X-ReID.",,,1,related
"Explainability refers to the ability of ViT to provide insights into its decisionmaking process, which is crucial for building trust in the model [1, 4, 47].",,,0,not_related
"Specifically, we use IntGrad (Sundararajan et al., 2017) with n=32 steps, ‘Input×Gradient’ (IxG), cf. Adebayo et al. (2018), as well as an adapted GradCAM (Selvaraju et al., 2017) as in Chefer et al. (2021).",,,1,related
The significant gains in quantitative interpretability metrics reported by Chefer et al. (2021) highlight the importance of such holistic explanations.,,,0,not_related
"Second, we evaluate two pixel perturbation metrics, cf. Chefer et al. (2021).",,,1,related
"In response, various improvements over attention rollout have been proposed, such as GradSAM (Barkan et al., 2021) or an LRP-based explanation method (Chefer et al., 2021), that were designed to more accurately reflect the computations of all model components.",,,0,not_related
", 2021) or an LRP-based explanation method (Chefer et al., 2021), that were designed to more accurately reflect the computations of all model components.",,,0,not_related
"Further, we evaluate architecture-agnostic methods such as Integrated Gradients (IntGrad) (Sundararajan et al., 2017), adapted GradCAM (Selvaraju et al., 2017) as in Chefer et al. (2021), and ‘Input×Gradient’ (IxG), cf. Adebayo et al. (2018).",,,1,related
"In contrast to attention explanations, which are not class-specific (Chefer et al., 2021), we find the model-inherent explanations of B-cos ViTs to be highly detailed and class-specific.",,,1,related
"For the last, we rely on the implementation provided by Chefer et al. (2021).",,,1,related
"For all these transformer-specific explanations, we rely on the implementation provided by Chefer et al. (2021).",,,1,related
"However, as transformers consist of many additional components, explanations derived from attention alone have been found insufficient to explain the full models (Bastings & Filippova, 2020; Chefer et al., 2021).",,,0,not_related
"First, we follow Chefer et al. (2021) and evaluate common transformerspecific explanations such as the attention in the final layer (FinAtt), attention rollout (Rollout) (Abnar & Zuidema, 2020), a transformer-specific LRP implementation (CheferLRP) proposed by Chefer et al. (2021), ‘partial…",,,1,related
"The configurations of the ViTs follow the conventional specifications for ViTs of size Ti, S, and B, cf. Chefer et al. (2021).",,,1,related
"On the conventional ViTs, we further evaluate LRP-based explanations: partial LRP (pLRP) Voita et al. (2019) and the transformer-specific LRP adaptation by Chefer et al. (2021) (CheferLRP).",,,1,related
"For all models, we rely on the implementation by Chefer et al. (2021), which we use unchanged for the conventional ViTs and modify as we describe below for the B-cos ViTs (C.1.1).",,,1,related
"However, instead of deriving an explanation ‘post-hoc’ as in Chefer et al. (2021), we explicitly design our models to be holistically explainable.",,,1,related
"…explanations such as the attention in the final layer (FinAtt), attention rollout (Rollout) (Abnar & Zuidema, 2020), a transformer-specific LRP implementation (CheferLRP) proposed by Chefer et al. (2021), ‘partial LRP’(pLRP) (Voita et al., 2019), and ‘GradSAM’ (Barkan et al., 2021).",,,1,related
"Transformer visualizations are not limited to the only ones listed here as new techniques are continually suggested in scientific publications which shows how versatile Transformer models are (Chefer et al., 2021).",,,0,not_related
"ViT-B
Fake-CAM [39] 62.8 54.0 57.7 47.9 99.8 28.6 0.87
Grad-CAM [46] 79.6 74.3 29.4 45.0 58.1 31.0 3.27 Grad-CAM++ [11] 84.2 80.6 14.8 23.8 51.4 27.3 4.15 Score-CAM [56] 77.6 71.6 46.0 54.3 66.1 33.1 3.14 XGrad-CAM [20] 82.0 76.9 19.6 41.3 52.8 28.5 3.31 Layer-CAM [26] 70.7 63.9 20.6 50.5 60.7 32.6 1.44 ExPerturbation [18] 71.5 64.9 35.9 44.6 62.3 35.3 1.34 RawAtt [16] 72.4 64.8 18.5 50.4 55.4 31.6 1.68 Rollout [1] 67.6 58.8 36.9 50.7 57.8 30.0 1.16 TIBAV [12] 70.1 63.1 26.6 58.8 66.1 35.0 1.23 Opti-CAM (ours) 64.4 54.6 54.5 48.0 58.2 28.7 0.98
DeiT-B
Fake-CAM [39] 61.4 54.0 57.7 47.9 99.8 28.7 0.83
Grad-CAM [46] 65.5 60.3 44.3 47.2 62.8 30.2 1.20 Grad-CAM++ [11] 70.6 67.2 34.3 43.6 57.7 30.3 2.14 Score-CAM [56] 79.9 76.2 31.9 43.8 63.4 32.2 3.14 XGrad-CAM [20] 82.0 78.4 19.5 44.1 53.4 28.8 3.03 Layer-CAM [26] 80.2 77.3 17.6 50.8 62.7 35.1 3.15 ExPerturbation [18] 69.9 64.3 36.2 44.2 63.1 35.5 1.16 RawAtt [16] 73.5 68.2 5.9 48.1 46.5 27.3 1.91 Rollout [1] 63.9 57.0 27.8 47.9 36.5 27.2 0.94 TIBAV [12] 68.2 62.2 28.1 59.6 64.1 33.5 1.08 Opti-CAM 62.3 55.1 53.9 48.0 55.1 28.8 0.84
Table A8: Localization metrics with ViT and DeiT on ImageNet validation set.",,,0,not_related
"TIBAV [12], which is designed for transformers, outperforms the other methods on DeiT and ViT.",,,0,not_related
"METHOD DEIT-B VIT-B
I↑ D↓ I↑ D↓
Fake-CAM [39] 57.5 34.2 57.4 33.3
Grad-CAM [46] 61.8 17.5 62.9 19.8 Grad-CAM++ [11] 60.5 21.9 56.7 29.3 Score-CAM [56] 60.6 24.4 66.5 15.1 XGrad-CAM [20] 55.2 31.1 55.6 26.5 Layer-CAM [26] 61.6 21.2 62.9 14.6 ExPerturbation [18] 62.1 27.0 64.4 18.4 RawAtt [16] 56.3 29.3 62.2 17.9 Rollout [1] 56.7 32.8 64.8 15.2 TIBAV [12] 63.7 16.3 66.1 14.1 Opti-CAM (ours) 59.2 22.8 60.5 22.0
Table A6: I/D: insertion/deletion [36] scores on ImageNet validation set; ↓ / ↑: lower / higher is better.
observation holds for deletion.",,,1,related
"For transformer models, we also compare against raw attention [16], rollout [1] and TIBAV [12]7.",,,1,related
TIBAV [12] uses both instance-specific and class-specific information.,,,0,not_related
"As an active research topic, current attention visualization methods mainly focus on dot-product attention [1, 11].",,,0,not_related
"The interpretability of the Transformer-based model is closely tied to the basis of this model, which is the mechanism of attention [4], as the attention matrix provides deep insight into the object and relations in it [5].",,,0,not_related
The comparison of attention maps in FBKD and FBKD-ProC-KD (ours) by using the Transformer Interpretability method [43].,,,1,related
"We provide the attention relevance maps [9] for the same image as shown in Figure 13 in the main paper, but for all three classes present in the image, in Figure 28.",,,1,related
Attention relevance (as in [9]) can significantly change at different patch sizes for both ViT and FlexiViT.,,,0,not_related
Attention relevance patterns across scales We find that decreasing the patch size results in attention relevance [9] to concentrate into a larger number of smaller areas throughout the image.,,,0,not_related
Top: Attention relevance (as in [9]) can significantly change at different patch sizes.,,,0,not_related
"2 [9] Hila Chefer, Shir Gur, and Lior Wolf.",,,0,not_related
"D.2 Measuring negative contribution While Shapley values estimate both the positive and the negative contributions of input tokens towards the model prediction – which is relevant for foil words –, attention (Chefer et al., 2021a) allows for positive-only relevance assessments.",,,0,not_related
"In Figures 10 and 11, we have visualised CLIPs attention-based relevancy for the image-caption and foil examples shown in Figures 2 to 7 using the method of Chefer et al. (2021a).",,,1,related
"…to assign relevancy values for image and text tokens, research strives to generate simple explanations that represent the most important tokens and tend to inhibit the rest, as can be seen on the progress from Chefer et al. (2021b) to Chefer et al. (2021a) (cf. Figure 4 in Chefer et al. (2021a)).",,,0,not_related
"CAM-, or propagation-based methods [39].",,,0,not_related
"However, some of these methods are classagnostic in practical applications [39].",,,0,not_related
"Propagation-based methods [39, 44-51] mostly rely on the deep Taylor decomposition (DTD) framework [44].",,,0,not_related
Raghu et al. (2021) compare how the internal representation structure and use of spatial information differs between ViTs and CNNs. Chefer et al. (2021) produce ‘image relevance maps’ (which resemble saliency maps) to promote interpretability of ViTs.,,,0,not_related
"Furthermore, the final layer in ViTs appears to behave as a learned global pooling operation that aggregates information from all patches, which is similar to its explicit averagepooling counterpart in CNNs.",,,0,not_related
"In other words, ViTs learn to preserve spatial information,
despite lacking the inductive bias of CNNs. Spatial information in patches of deep layers has been
explored in Raghu et al. (2021) through the CKA similarity measure, and we further show that spatial information is in fact present in individual channels.",,,0,not_related
"After probing the role of spatial information, we delve into the behavioral differences between ViTs and CNNs.",,,0,not_related
"When performing activation maximizing visualizations, we notice that ViTs consistently generate higher quality image backgrounds than CNNs.",,,1,related
"As extensive work has been done to understand the workings of convolutional networks, including similar feature visualization and image reconstruction techniques to those used here, we may be able to learn more about ViT behavior via direct comparison to CNNs.",,,0,not_related
Chefer et al. (2021) produce ‘image relevance maps’ (which resemble saliency maps) to promote interpretability of ViTs.,,,0,not_related
"Given their rapid proliferation, there is naturally great interest in how ViTs work and how they may differ from CNNs.",,,0,not_related
"We visualize the saliency maps [12] of DeiT-S and OAMixer on top of it, trained on ImageNet9.",,,1,related
"First, the advance of unsupervised [11, 36, 50] and weakly-supervised [12, 43, 60] saliency detection significantly reduced the labeling cost of objects.",,,0,not_related
The last two columns are the attention maps extracted by the method [93] to demonstrate the focus area of the model without and with the proposed AP modules.,,,0,not_related
"C V
] 2
7 N
ov 2
terpretability methods, like CAM [46] and Transformerinterpretability [5], can support such an argument, such as in the work of [61].",,,1,related
"terpretability methods, like CAM [46] and Transformerinterpretability [5], can support such an argument, such as in the work of [61].",,,0,not_related
"Finally, we perform visualization experiments using the (Chefer, Gur, and Wolf 2021) method to show the focused areas of the model.",,,1,related
"When ViT first demonstrate its powerful performance to outperform previous CNN-based baselines [8], its unique model structure has attracted extensive focus from researchers to understand its interpretability from different aspects, including: observing the attention map of Transformer outputs [3,15], computing the relevancy of different attention heads in Transformer networks [5, 26].",,,0,not_related
We applied the method described in [6] to interpret the learned representations from three selfsupervised learning approaches.,,,1,related
"Furthermore, we visualize the attention from the pre-trained weights using the method described in [6].",,,1,related
"In comparison with CNNbased neural networks, the recently developed attention-based transformer models represent a potential paradigm change in the middle of the 2020s.(25) When compared with CNNs, the recovered features from transformers can more accurately reflect long-range dependency within the sequence, and they also carry more semantic information.",,,0,not_related
"The flexibility of Transformers for various input modalities [226] and the inherent interpretability of learned attention scores [227], [228] lend themselves well to the self-driving domain.",,,0,not_related
"…DeepLift, LRP, etc. (Simonyan et al., 2014; Smilkov et al., 2017; Shrikumar et al., 2017; Sundararajan et al., 2017; Xu et al., 2020; Selvaraju et al., 2017; Bach et al., 2015; Shrikumar et al., 2016; Chefer et al., 2021; Montavon et al., 2017; Shrikumar et al., 2017; Schwab & Karlen, 2019).",,,0,not_related
The recent approaches presented in [23] and [24] go beyond interpretability solely based on attention weights and generate model explanations by utilizing all components in the transformer architecture.,,,0,not_related
"In the future, other than class activation maps, we will seek to explore the explainability for Vision Transformers in multi-label classification tasks, with the help of self-attention derived from the Transformer architectures [12, 79, 1, 13].",,,1,related
’s method [190] can reach better performance.,,,0,not_related
[190] proposed a novel method for computing the correlation of the Transformers network.,,,0,not_related
[190] proposed to explore attention visualization to interpret the principle of Transformer.,,,0,not_related
"For non-parametric layers (add layer and matrix multiplication), the authors of [7].",,,0,not_related
"To circumvent the black-box nature of the Deep Neural Networks, recent studies have tried explaining their decisions [8, 9, 10, 11, 7].",,,0,not_related
The computation of the weighted attention map is inspired by [15] and [7].,,,0,not_related
"On the contrary, their method is class-specific, as [7] integrates the relevance scores with the gradient of attention w.",,,0,not_related
Our method is compared with the state-of-the-art explainers with a recently adapted version of Relevance Propagation for the transformers [7] being amongst them.,,,1,related
"In [16], the authors of [7] extended their work for coattention methods performing multimodal input (images and text) and encoder-decoder attention.",,,0,not_related
"Heat maps built upon explanation maps are obtained on a number of state-of-the-art methods such as Grad-Cam [10], adapted relevance propagation [7], rollout method [15], and our self-attention weighted method (SAW).",,,0,not_related
"al [7] proposed a transformer explanation inspired by LRP [11] method, which was developed for explaining the decisions of CNNs.",,,0,not_related
"In particular, Yuan et al. (2021) and Chefer et al. (2021) are promising examples of approaches based, partially or entirely, on gradient information.",,,0,not_related
"In particular, there have been some approaches based, partially or entirely, on gradient information, such as GradCam Yuan et al. (2021); Chefer et al. (2021).",,,0,not_related
"Specifically, given a vision transformer model F and a sampled pair (x,y), we first acquire the class activated matrix C of the b−th block of F following [6], which can be formulated as:",,,1,related
"In this experiment, we verify the improvement of AdsCVLR compared with single modal models on these “hard” samples through a visualization method [1].",,,1,related
"We make a visualization on each level in Figure 6, we use the method proposed in [40,41] to generate the visualization maps.",,,1,related
"Ablation experiments and a variety of representation analyses have been applied to understand the role of the attention mechanism in NLP tasks as well as in transformer-based vision models (Chefer et al., 2021; Manning et al., 2020; Michel et al., 2019; Voita et al., 2019).",,,0,not_related
"Besides, Zabari & Hoshen (2021) obtains segments via interpretability Chefer et al. (2021b) based on gradient, but owing to the limited localization quality, additional unsupervised segmentation algorithm is required.",,,1,related
"To get rid of costly pixel-level annotations, some works generate the segments by retrieval Shin et al. (2022), grouping Xu et al. (2022) or unsupervised segmentation Zabari & Hoshen (2021) with gradient-based interpretability method Chefer et al. (2021b).",,,1,related
"We firstly compare our dense ITSM with smoothed min pooling with gradient based visualization method Bi-Module Chefer et al. (2021a), and our method performs much better than it.",,,1,related
"Head operations commonly found in the literature are averaging [6, 12, 33] and summing [34, 35] the attention matrices of each head.",,,0,not_related
"A recent method that does not solely rely on raw attention to provide explanations, is combining relevance and gradient information [6].",,,0,not_related
Operations concerning the resulting matrices of self-attention layers include averaging [35] and multiplying [6].,,,0,not_related
Other transformer-specific interpretability approaches combine attention with gradient information [6] or compute new attentions based on the network’s residual connections [7].,,,0,not_related
"To obtain the final interpretation vector, a common approach is to consider the attention that each input token receives from the special [CLS] token that is prepended at the beginning of sequences in text classification tasks [6, 12].",,,0,not_related
[10] expand the class-agnostic self-attention of rollout to class-specific.,,,0,not_related
"[9] (Bi-Model) is the latest method based on [10] for transformer, and [33] (Grad-CAM) is the most used gradient based method.",,,0,not_related
"Note, Bi-Model [9] is based on the latest explainability method [10] for ViT.",,,1,related
"Besides, Bi-Model [9] based on [10] treats CLIP as ViT [14] and explains it with self-attention, even the quality of self-attention in CLIP is bad (see Fig.",,,0,not_related
"Most existing methods for visual explainability are designed for convolutional networks [41, 44] or vision transformers [9, 10].",,,0,not_related
"Another explainable method [9] treats CLIP as vision transformer [10] and relies on the self-attention of ViT [14] to explain the images, followed by rollout [1] to expand classagnostic attention map into class-specific.",,,0,not_related
The literature (Chefer et al. 2021) proposed a DTD-based decomposition algorithm to solve the problems caused by residual connection and matrix multiplication operations.,,,0,not_related
The power of these methods has led to their adoption in the field of language and vision (Chefer et al. 2021; Lu et al. 2019).,,,0,not_related
"[28], which leads to low credibility of the final results.",,,0,not_related
"Here the method described in [3] is used, the corresponding values per token are referred to as “attention weights” here.",,,1,related
"For ViTs, some reasons the decision-making process via gradients [10, 14, 15], attributions [6, 41] and redundancy reduction [26].",,,0,not_related
"To visualize the regions of the AS-OCT images that contributed to the model’s decisions, Gradient-weighted Class Activation Mapping (Grad-CAM) [39] will be extracted from the first LN of the last block of the transformer encoder.",,,0,not_related
"And [49], [80], [219] expanded on this approach toward the goal of multi-step attribution across multiple layers.",,,0,not_related
"Recent studies have therefore been attempting to improve the quality and sharpness of the maps by focusing on objects, for example, by combining Grad-CAM and LRP [25], applying LRP to Vision Transformers [5], improving ABN with Score-CAM [26], and even human intervention [33] or additional supervision [27].",,,0,not_related
The latest researches’ results [60]–[65],,,0,not_related
"In contrast to pure self-attention based ViTs, the enhanced visual interpretability of hybrid ViTs [28, 54] allows us to extract these salient regions utilizing general methods such as gradient based class activation maps (Grad-CAM) [4, 38].",,,0,not_related
"It is a interesting future direction to investigate how different VLMs [7–11], their training procedure [43], and different relevancy approaches [18, 22, 44, 45] affect the performance of different downstream 3D scene understanding tasks.",,,0,not_related
"Our intuition is that the neural activation map of even a partially trained classification network can better localize some part of an object [40,4] than using naive score averaging.",,,0,not_related
"Although it is wrong to equate attention scores with explanation [44], it can offer plausible and meaningful interpretations [45], [46].",,,0,not_related
[13] proposed a layer-wise relevance propagation (LRP) method by introducing a relevancy propagation rule that is applicable to both positive and negative contributions.,,,0,not_related
[13] proposed a layer-wise relevance propagation (LRP) method to compute different relevance of the attention heads throughout the transformer.,,,0,not_related
"Alternatives include methods to compute and propagate trained attention-based token relevancy scores (Chefer et al., 2021), or to generate higher-level conceptual explanations (Rigotti et al., 2021).",,,0,not_related
"Alternatives include methods to compute and propagate trained attention-based token relevancy scores (Chefer et al., 2021), or to generate higher-level conceptual explanations (Rigotti et al.",,,0,not_related
"For each layer, we present the patch-to-patch attention matrix (size: 180×180) calculated by the rollout method in [32].",,,1,related
[32] enhanced this method by adding an additional identical matrix before multiplication to simulate the effect of residual connection of MSA.,,,0,not_related
(d) visualizes the impact of each spatial location on the final prediction in the DeiT-S model [47] using the visualization method proposed in [4].,,,0,not_related
"It is also quite challenging to interpret vision transformers’ decisions [66], e.",,,0,not_related
"To investigate the performance of our model, we used the class activation map (CAM) [55] to visualize the attention maps generated by our ACSI-Net.",,,1,related
"With the introduction of the deep neural network model with attention, its attention weights also play an important role in the XAI field[23,50,6].",,,0,not_related
"The third term considers the explainability map of CLIP, given the input image and the caption [13] as a guide for the foreground mask.",,,0,not_related
"We present visualizations of target class activation maps using the recent Transformer Explainability [2]
for several images in Figure 5 to showcase the behavior of SPViT.",,,1,related
Figure 5: Visualization using Transformer Explainability [2].,,,0,not_related
We present visualizations of target class activation maps using the recent Transformer Explainability [2] for several images in Figure 5 to showcase the behavior of SPViT.,,,1,related
"These methods achieve mixed results in quantitative benchmarks, whether for object localization or the removal of influential features [42, 25, 49, 10, 31], and they are somewhat insensitive to the randomization of model parameters [2].",,,0,not_related
"Among the baselines, RISE and LRP remain most competitive, but ViT Shapley performs best for both datasets.",,,0,not_related
"Among those shown here, LRP is most similar to ViT Shapley, but they disagree in several cases.",,,0,not_related
"Attention last This approach calculates the attention directed from each image token into the class token in the final self-attention layer, summed across attention heads [1, 10].",,,0,not_related
"Other methods modify the gradient backpropagation algorithm to generate attribution scores that satisfy certain properties [4, 53, 3], including the layer-wise relevance propagation (LRP) approach that was recently extended to transformers [10].",,,0,not_related
"Recent work has disputed the role of attention as an indicator of feature importance [51, 29, 63, 10], and we find in our experiments that attention is a poor proxy for the effect of removing features from a model.",,,0,not_related
"For attention-based methods, we use attention rollout [1] and the last layer’s attention directed to the class token [1, 10].",,,1,related
"Layer-wise relevance propagation (LRP) Originally described as a set of constraints for a modified backpropagation routine [4], LRP has since been implemented for a variety of network layers and architectures, and it was recently adapted to ViTs [10].",,,0,not_related
"We show results for attention last, attention rollout, Vanilla Gradients, Integrated Gradients, SmoothGrad, LRP, leave-one-out, and ViT Shapley only; we excluded VarGrad, GradCAM and RISE because their results were less visually appealing.",,,1,related
We used an implementation provided by prior work [10].,,,1,related
"Our evaluation was conducted on a GeForce RTX 2080 Ti GPU, with minibatches of 16 samples for attention last, attention rollout and ViT Shapley; batch size of 1 for Vanilla Gradients, GradCAM, LRP, leave-one-out and RISE; and internal minibatching for SmoothGrad, IntGrad and VarGrad (implemented via Captum [35]).",,,1,related
"Similar to prior work [10], we did not use attention flow [1] due to the computational cost.",,,1,related
