text,label_score,label,target_predict,target_predict_label
"larger than the ones of normal samples, some methods [15], [16], [27], [29] combine AE and the traditional memory",,,0,not_related
"3) Evaluation: Following [27], [41], the area under the curve (AUC) of the receiver operating characteristic (ROC) of the image level and pixel level are used to measure the performance of model.",,,0,not_related
"Recently, Some existing works introduce memory bank to computer vision tasks [50], [51], such as fake video detection [52] and anomaly detection [27], [29].",,,0,not_related
[27] proposes a combination network of AE and memory module for video anomaly detection.,,,0,not_related
"However, the powerful reconstruction ability of AE is not beneficial for visual anomaly detection [15], [27].",,,0,not_related
"Moreover, Existing methods [15], [27] adopt a scheme, which concatenates the outputs of last encoder and the reads of the memory module as the input of the decoder.",,,0,not_related
"As shown in Figure 1 (1) and Figure 1 (2), the query generated by the traditional method is a logical reorganization of features at the same location but from different channels of the original feature map [16], [27].",,,0,not_related
"3) Evaluation: Following [27], [41], the area under the curve (AUC) of the receiver operating characteristic (ROC)",,,0,not_related
The work [12] further improves the original memory module and introduces a new loss function to improve the learning of the memory module.,,,0,not_related
"However, anomalous events are incidental and diverse resulting in the impracticality of collecting the sufficient anomalous samples [11], [12].",,,0,not_related
"Some methods are proposed [11], [12], [17], [29] to reduce the reconstruction ability of AE by introducing memory networks.",,,0,not_related
"Our method demonstrates the capability of detecting different anomalous events and even presents better performance than memory-based methods, such as MemAE and MNAD, that are specially designed to deal with various anomalies.",,,0,not_related
7) Memory-Guided Normality for Anomaly Detection (MNAD) [74]: MNAD uses a memory module to record multiple prototypes that represent diverse representations of normalities for unsupervised anomaly detection.,,,0,not_related
"In this article, we equip it on the MNAD [74] model, which is still denoted SSPCAB.",,,1,related
"Specifically, in the highway scene, our method presents a better performance of detecting different anomalies than memory-based methods, i.e., MemAE and MNAD, which are specially designed to deal with various anomalies.",,,0,not_related
7) Memory-Guided Normality for Anomaly Detection (MNAD) [74]: MNAD uses a memory module to record,,,0,not_related
"For anomaly detection in aerial videos, comparing with the commonly used reconstruction-based framework [31], [66], [67], [68], [69], [70], [71], [72], [73], [74] where target values are equal to the inputs, it is more natural to predict the",,,0,not_related
"our prediction-based framework with a commonly used reconstruction-based methodology [31], [66], [67], [68], [69], [70], [71], [72], [73], [74].",,,0,not_related
"Memory-based and GAN-based
methods, namely, Skip-GAN, MemAE, and MNAD, show superior performance in this scene.",,,0,not_related
"In recent years, many methods for video anomaly detection [23, 34, 43] have been proposed with great success.",,,0,not_related
"Anomaly detection in literature can be categorized into 3 groups; which are memory-based methods [12], one-class classification methods [16] and current",,,0,not_related
"AE [6,13,16,25] and GAN [26,29,39] are intuitive choices of reconstruction models.",,,0,not_related
[25] introduce a memory module to select the most similar embedding in embedding storage of normal samples to restrict the generalization on anomalies.,,,0,not_related
"Among them are (1) reconstruction-based approaches such as Conv-AE [29], TSC [15], StackRNN [15], MemAE [12], MNAD [9], etc.; (2) prediction-based methods: Frame-Pred [8], PGDLE [10], IPR [37].",,,0,not_related
"Among them are (1) reconstruction-based approaches such as Conv-AE [29], TSC [15], StackRNN [15], MemAE [12], MNAD [9], etc.",,,0,not_related
[9] employed the same network structure as Gong et al.,,,0,not_related
"As revealed by the existing works [8, 9, 42], Peak Signal to Noise Ratio (PSNR) is a more accurate method to determine the picture’s grade, shown as following:",,,0,not_related
"In compared to the method MNAD [9] with a memory module, its performance illustrated by the experimental outcomes on 3 datasets has been elevated, whether it is a reconstruction task or a prediction task.",,,0,not_related
"[9], developed a hybrid framework integrating optical flow reconstruction and frame prediction to carry out video anomaly detection.",,,0,not_related
"[56] 32 MemAE [12] 38 PGDLE [10] 42 MNAD [9] 67 Ours 46
1 3",,,0,not_related
[9] adopted multiple prototypes to represent different models of normal video frames.,,,0,not_related
"Future frame prediction is another prevalent video anomaly detection (VAD) methodology, which commonly achieves a better anomaly detection accuracy than reconstruction-based methods [9, 34, 35].",,,0,not_related
"Notably, prediction may be regarded of as a reconstruction of the future frame based on prior frames [9].",,,0,not_related
"Following previous work [3], [19], The PSNR of each test frame is normalized to the range [0, 1] and the following formula calculates the regular score of each frame:",,,0,not_related
"The prediction-based VAD methods [3], [18], [19] consider the instances with lower prediction errors as normal while considering unpredictable events as abnormal.",,,0,not_related
"However, we evaluate the quality of predicted frames utilizing the Peak Signal to Noise Ratio (PSNR), which has proven to be a more effective measure [19].",,,0,not_related
"Similarly, LMN [11] proposes to manually update the memory module, along with a triplet loss to better reflect normal behavior patterns.",,,0,not_related
[11] introduced memory into autoencoders in video anomaly detection.,,,0,not_related
"It is worth pointing out that training only on normal data is often claimed as unsupervision like [11], [13], [30] recently.",,,0,not_related
"[17] integrated a memory network with an encoder-decoder scheme, where components in the memory network record prototypical",,,0,not_related
"As we can see, ST-AE and MNAD score lower in AUC than the proposed method, although they achieve a high value on public datasets such as UCSD [40] and ShanghaiTech [41].",,,1,related
One is a baseline spatial-temporal AE network (ST-AE) [12] and the other is the state-of-the-art video anomaly detection based on memory-guided normality for anomaly detection (MNAD) [17].,,,0,not_related
"If there are multiple attentions, the output of multihead cross‐attention is shown in Equation (12).",,,0,not_related
"⋯ ( ) M MCA = CA + CA + + CA / , i i i i 1 2 (12)",,,1,related
"(2) A dictionary is trained where patterns of normal events are recorded based on their high-level semantic features, and the score of abnormality is calculated with the help of the dictionary [23, 29, 33].",,,0,not_related
"Compared with real-time models, TSSTGM is still a little lower than P w/Mem model [23].",,,0,not_related
"The comparison approaches include FSCN [29], Conv-AE [7], STAE [3], P w/Mem [23], ConvLSTM-AE [18], STAE-grayscale [34], STAE-optflow [34], Optical flow-GAN [25], ST-CaAE [14], STAN [13] and the methods proposed by Gao et al.",,,0,not_related
"[23] propose a model, called P w/Mem, using a memory module with an update scheme where items in the memory record prototypical patterns of normal data.",,,0,not_related
"Either separately training the feature extraction and clustering steps [48,13,14,41,32], or jointly training both steps end-to-end [1,11,34,3,27,2].",,,0,not_related
"[31] both proposed to record prototypes of normal data by inserting a memory bank into AE, which can enhance the ability of AE to model normal behavior patterns.",,,0,not_related
"In addition, in order to make prototypes have the characteristics of compactness and diversity, we follow the work [31] using feature compaction loss and feature separation loss to constrain prototypes.",,,1,related
"[31] followed this trend and presented an anomaly detection method that uses multiple prototypes to consider various patterns of normal data, which can obtain more compact and sparse memory bank.",,,0,not_related
"In addition, MemAE [11], MNAD [31], and MPN [27], are most-related methods to our approach.",,,0,not_related
[31] have enhanced the ability of AE to model normal frames by establishing a memory bank.,,,0,not_related
"Compared with previous memory bank based methods [11,31], DLAN can automatically learn prototypes online without additional memory consumptions.",,,0,not_related
"The use of memory mechanisms [16, 43] or multi-modal data (e.",,,0,not_related
"To address this, some follow-up studies attempt to boost the accuracy through incorporating memory modules [16, 43], modeling optical flows [29], redesigning specific architectures [58], etc.",,,0,not_related
"In previous work, researchers define video content patterns that are different from usual patterns are anomalies [1-5].",,,0,not_related
There mainly are two methods: 1) unsupervised learning methods [1-5] train the detection model with only normal samples and the different patterns in test part are considered as anomalies.,,,0,not_related
Gong et al. (MemAE) [4] and Park et al. (LMN) [5] introduce a memory bank into the AE for anomaly detection.,,,0,not_related
2) Weakly supervised learning methods [5-10] distinguish abnormal and normal events with video-level annotations.,,,0,not_related
(LMN) [5] introduce a memory bank into the AE for anomaly detection.,,,0,not_related
"VAD is an important yet challenge task, which has been researched for decades [1-10].",,,0,not_related
"The reconstruction error defines the novelty score [40,15,59]: GAN and flow-based invertible models have been exploited for this purpose [71,80,51].",,,0,not_related
"Different from previous work [10], considering the diversity of normal events, only part of the query vectors are written into the memory pool instead of all, which helps the pool to record general patterns of normal events.",,,0,not_related
"However, most existing methods [3, 4, 10] do not consider the difference of spatial and temporal features in isolation.",,,0,not_related
"Follow previous works [3, 10], e is defined as the peak signal-to-noise ratio between the predicted frames Ît and the ground truth It, as follows:",,,0,not_related
"Since most surveillance videos are normal, some previous works [2][3][4][5] treat anomaly detection as an unsupervised learning task.",,,0,not_related
"To detect whether a frame is anomalous or not, we use PSNR to calculate the abnormal score [2] [3] [5] [7] [13].",,,1,related
"According to the previous work [1] [5] [13], we calculate the Area Under Curve(AUC) of the Receiver Operation Characteristic(ROC), and compare it with hand-crafted based method [15] [20], prediction-based method [5], convolution LSTM based method [16] [17] [21], memory-based method [2] [13], and two-stream based method [1] [3] [4] [7].",,,1,related
"We compare our method with well-designed state-of-the-art methods including Stacked RNN [36], ConvAE [14], AE [37], MemAE [37], and MMNP [38].",,,1,related
The former uses only normal videos to train a deep model to understand the archetypal space-time patterns of normal occurrences through the solution of a proxy problem like reconstructing [13] or predicting video frames [14].,,,0,not_related
[14] proposed an encoder-decoder with a learned memory module to predict future frames.,,,0,not_related
"…gains with respect to SSMTL (Georgescu et al., 2021), while also attaining superior results compared to other recent state-of-the-art methods (Astrid et al., 2021a,b; Bertasius et al., 2021; Chang et al., 2022; Dong et al., 2020; Doshi and Yilmaz, 2020a,b; Georgescu et al., 2022; Gong et…",,,0,not_related
"…Cheng et al., 2015; Feng et al., 2017; Hinami et al., 2017; Kim and Grauman, 2009; Mehran et al., 2009; Wu et al., 2010), reconstruction-based (Astrid et al., 2021a; Gong et al., 2019; Hasan et al., 2016; Huang et al., 2022a,b,c; Luo et al., 2017, 2022; Nguyen and Meunier, 2019; Park et al.,…",,,0,not_related
"In addition, we note that our approach is different from the method proposed by Astrid et al. (2021a), since this related method aims to reconstruct unmodified frames from pseudo-abnormal frames without changing the learning procedure, i.e. without reversing the gradients, as we do.",,,1,related
"1* Corresponding author Various methods related to the unsupervised anomaly detection [2, 3, 4, 5] have been explored.",,,0,not_related
"Also, in [18], they introduced a memory module with items that capture prototypical models of the inlier class with a new update system.",,,0,not_related
"methods include Conv-AE[4], 3D-Conv[35], MemAE[1], and MNAD-R[6], while MNAD-P[6], AMMC-Net[8], FramePred[5], VEC[7], C2-D2GAN[3], and Transanomaly[14], are TABLE IV AUROC PERFORMANCE (%) COMPARISON WITH PREVIOUS WORKS ON UCSD PED2, CUHK AVENUE AND SHTECH DATASETS",,,0,not_related
"First, reconstruction-based methods include Conv-AE[4], 3D-Conv[35], MemAE[1], and MNAD-R[6], while MNAD-P[6], AMMC-Net[8], FramePred[5], VEC[7], C2-D2GAN[3], and Transanomaly[14], are
prediction-based methods and HF2-VAD[2] is the hybrid method.",,,0,not_related
"with a memory module[1], [6], [8] have been extensively studied.",,,0,not_related
"To alleviate this generalizing issue, an AE with a memory module[1], [6], [8], has been proposed in recent years.",,,0,not_related
"Dataset Future Frame Prediction [79] MLEP [78] MNAD [114]
Street Scene [123] 3130 48000* 37 Subway Entrance [1] 1000 1000* 43 UCF-Crime [150] 2105 10000* 2
*: In MLEP, the training process gets randomly video snippets as input, so we can only get the number of iterations needed to obtain the result.",,,1,related
"From the results is presented in Table 10, it is clear that almost all of the state-of-the-art approaches primarily focused on unsupervised or weakly-supervised deep learning are becoming increasingly pervasive on video tasks, specifically anomaly analysis tasks because of the overall performance of these methods outperforming all traditional methods on two different public benchmark datasets by a large margin such as Future Frame Prediction [79], MLEP [78], Memoryguided Normality [114].",,,0,not_related
"Street Scene [123] Subway Entrance [1] UCF-Crime [150] Method
AUC EER AUC EER AUC EER
Future Frame Prediction [79] 56.53 46.14 71.72 32.22 66.53 38.67 MLEP [78] 53.46 30.49 77.30 46.63 55.08 47.05 MNAD [114] 57.25 44.36 69.37 35.69 65.53 39.69
number of epochs and iterations with the best result of each method showed in Table 12.",,,1,related
"Notable unsupervised learning methods for anomaly analysis in videos [79, 100, 114, 182].",,,0,not_related
"In this section, the goal of our experiments is to evaluate three benchmark methods including Future Frame Prediction [79], MLEP [78] and MNAD [114] on three most commonly used datasets namely Street Scene [123], Subway Entrance [1], and UCF-Crime [150] in terms of EER and ROC-AUC metrics at frame-level to evaluate these results of these methods performed on diferent anomalous video datasets.",,,0,not_related
"In this section, the goal of our experiments is to evaluate three benchmark methods including Future Frame Prediction [79], MLEP [78], and MNAD [114] on three most commonly used datasets, namely, Street Scene [123], Subway Entrance [1], and UCF-Crime [150] in terms of EER and ROC-AUC metrics at frame-level to evaluate these results of these methods performed on different anomalous video datasets.",,,0,not_related
"Table 11 shows percentages of three prominent methods namely Future Frame Prediction [79], MLEP [78] and MNAD [114] on three abnormal video datasets in terms of AUC and EER metrics at frame-level.",,,0,not_related
Dataset Future Frame Prediction [79] MLEP [78] MNAD [114],,,0,not_related
"Table 11 shows percentages of three prominent methods, namely, Future Frame Prediction [79], MLEP [78], and MNAD [114] on three abnormal video datasets in terms of AUC and EER metrics at frame-level.",,,0,not_related
"With regard to the AUC metric, the number of MNAD method is the highest igure of the three well-known methods on the Street Scene dataset at 57.25%, however, the igure of this method on the Subway Entrance dataset is the lowest at 69.37%.",,,0,not_related
"Furthermore, the MNAD method is also slightly lower than that of the Future frame prediction method on the UCF-Crime dataset at 65.53% compared to at 66.53%.",,,0,not_related
", structural [53] or semantic [39, 46]), memory mechanism [19, 20, 29], iteration mechanism [12], image masking strategy [47], and pseudo-anomaly [9, 32].",,,0,not_related
Anomaly Detection aims to detect unusual samples in data.,,,0,not_related
"Deep Anomaly Detection [62, 63, 56, 36, 48, 3, 76, 51, 5, 16, 53, 54, 55, 20] takes the advantage of DNNs to have better scalability and performance on high dimensional data.",,,0,not_related
"They were adopted in several tasks such as object tracking [14, 43], anomaly detection [16,36], predictive learning [19,28,29], and few-shot learning [8, 23, 45].",,,0,not_related
"Hence, video anomaly detection has been attracting an increasing amount of research interest, with most of the recent approaches heavily dependent on end-to-end trained complex deep learning based approaches [11, 32, 43].",,,0,not_related
"Recent algorithms can be broadly classified into reconstruction based approaches [15, 17, 36, 41, 43], which try to classify frames based on the reconstruction error, and prediction based approaches [8, 11, 29, 32], which attempt to predict a future frame, primarily by using generative adversarial networks (GANs) [16].",,,0,not_related
"A common technique used by several recent works [22, 32, 40, 43] is to normalize the computed statistic for each test video independently, including the ShanghaiTech dataset.",,,0,not_related
"The results show that the DPU is more memory-efficient than the memory module in previous work [17], [18].",,,0,not_related
"UCSDPed1 is relatively poor, whilst for CUHK Avenue, the AUC is better than most methods, except FlowNet-Unet-GAN [14], MemAE [17], LMN [18], MPD [19].",,,0,not_related
"Performance on UCSDPed1 is relatively poor, whilst for CUHK Avenue, the AUC is better than most methods, except FlowNet-Unet-GAN [14], MemAE [17], LMN [18], MPD [19].",,,0,not_related
"We achieve 75 fps for anomaly detection with a GeForce GTX TITAN X, faster than other state of the art methods with the same setting [18].",,,1,related
"As in previous work [18], the DPU inputs the encoding feature maps, which are outputs of the encoder part of U-net, to generate a pool of dynamic prototypes.",,,0,not_related
"However, MemAE [17], LMN [18] and MPD [19] have more parameters than our models which is shown in table III.",,,0,not_related
"A memory module is proposed into the AE to address these problems [17], [18].",,,0,not_related
"Since normal patterns in training and testing sets may be different, the memory items are updated during training and testing time, with the use of a predefined threshold to prevent updating on anomaly patterns [18].",,,0,not_related
"[4], [5], [9], [10], [11] or a prediction task [2], [12], [13], [14].",,,0,not_related
"By weakening the strong generalization ability with a new memory module and maximizing the margin between abnormal and normal samples via few-shot learning, it makes the model more sensitive to abnormal behaviors and improves the model’s discrimination ability, compared with both prediction-based models(4,28) and memory-based models.(3,9) By observing the above tables, we can further draw the following conclusions.",,,0,not_related
"In [36], they added a new update system to the memory module for",,,0,not_related
"[44] further improved performance by introducing extra loss functions such as intra-class distance and inter-class distance, but its application scope was limited to the computer vision field.",,,0,not_related
"We also compare our method with the state-of-the-art video prediction methods, including FFP, latent space autoregression (LSA) [47], memory-guided normality method (MNN) [48], ADL [20], deep multi-branch mask network (DMMNet) [49], future frame prediction network (F2PN) [50] and non-local U-Net (NU-Net) [51].",,,1,related
The performance of MNN is also influenced by the size of memory.,,,0,not_related
"And we observe that the methods which use memory networks to keep the representations, such as MemAE [7], MNAD-R [21], MNAD-P [21], and AMMC-Net [3], have a limited performance for anomaly detection on Avenue and ShanghaiTech.",,,0,not_related
"Within our best knowledge, we compare our AMSRC with stateof-the-art methods, including: (1) classic video anomaly detection methods: MPPCA [10], MPPC+SFA [19], and MDT [19]; (2) reconstruction-based methods: ConvAE [8], ConvLSTM-AE [17], MemAE [7], andMNAD-R [21]; (3) prediction-basedmethods: FramePred [13], MNAD-P [21], and VEC [31]; (4) hybrid and other methods: Stacked RNN [18], AMC [20], AnoPCN [29], AMMC-Net [3], and HF2-VAD [14].",,,1,related
"Reconstruction-based methods [7, 8, 17, 21] usually train an autoencoder on normal data and expect abnormal data to incur larger reconstruction errors at test time, making abnormal data detectable from normal ones.",,,0,not_related
The trained models for MNAD and MOVAD on ShanghaiTech dataset are not publicly available.,,,0,not_related
"Performance (AUC) drop in FFPN [18], MNAD [23], and MOVAD [7] due to the Slow-Fast-Freeze effect.",,,0,not_related
"For detecting anomalies, both MNAD and FFPN compute the Peak Signal to Noise Ratio (PSNR) between the actual frame and predicted frame.",,,0,not_related
"Performance drops of FFPN [18] with adversarial ShanghaiTech dataset (top), MNAD [23] with adversarial Avenue dataset (middle), MOVAD [7] with adversarial Avenue dataset (bottom).",,,1,related
"(iii) Finally, we used our new datasets simulating the Wi-Fi deauthentication attack to evaluate performance of several state-of-the-art DNNbased anomaly detection methods: Future Frame Prediction [18], Memory-guided Normality for Anomaly Detection (MNAD) [23], Modular Online Video Anomaly Detector (MOVAD) [7].",,,1,related
"The recent DNN-based methods can be categorized into two main groups, prediction-based [4, 6, 16, 18] and reconstructionbased [9, 11, 20, 22, 23].",,,0,not_related
We notice that the AUC drops from 0.855 to 0.795 for the FFPN approach and from 0.885 to 0.819 for the MNAD model.,,,1,related
"In this section, we evaluate the performance of existing state-of-the-art approaches, namely the Future Frame Prediction (FFPN) [18], Memory-guided Normality for Anomaly Detection (MNAD) [23], and Modular Online Video Anomaly Detector (MOVAD) [7] on the generated adversarial datasets.",,,1,related
"Memory guided normality for anomaly detection is proposed in (Park et al., 2020).",,,0,not_related
"Most existing anomaly detection methods, such as autoencoder-base methods [13, 18, 38, 71, 73], GAN-base methods [39, 45, 48, 68], selfsupervised methods [2, 11, 12, 25, 50, 56, 60], and one-class classification methods [7,8,40,43], assume that only normal data can be accessed during training.",,,0,not_related
"Methods in [4, 5] apply the memory module to restrict the space of prototypical normal patterns, which prevents abnormal patterns from being decoded.",,,0,not_related
"Moreover, in addition to the reconstruction loss (L2 loss), the feature compactness loss and feature separateness loss [5] are applied in order to enhance the memory space’s representativeness and discriminability, which are expressed as follows.",,,0,not_related
"Video anomaly detection (VAD) aims to identify anomalous events on both the object level [7, 22, 68] and frame level [35, 39, 51] by techniques such as skeleton trajectory modeling [43], weakly supervised learning [69], attention [47], temporal pose graph [38], self-supervised learning [10] and autoencoders [3].",,,0,not_related
"More specifically, we neither use the normal class annotations as in one class classification (OCC) approaches [12, 37, 54], nor binary annotations used by the weakly supervised anomaly detection systems [50,67,69,74].",,,1,related
"Note that, the term ‘unsupervised’ in literature often refers to OCC approaches which assume all normal training data [11, 37, 64, 66].",,,0,not_related
"Similarly to [12], discriminative normality action features prototypes are learnt based on nearest neighbor distances within the memory space via a loss that favors compactness of data samples around prototypes:",,,0,not_related
"Similarly to [11, 12], we incorporate a memory block in our framework in order to model diverse normality patterns.",,,1,related
"In addition, training 3 is much faster than in [12]: only 70 min on ShanghaiTech, 9 min on Avenue and 4 min on UCSD ped2 with a single NVIDIA TITAN X (PASCAL) GPU.",,,0,not_related
"∗Equal contributions reconstruction-based methods [10, 11, 12, 4, 13].",,,0,not_related
"Instead, we propose to tackle these challenges by extending the mainstream reconstruction assumption on which most state-of-the-art methods [3, 11, 12, 13] are implicitly based: Given a normality model, normal observations are easier to reconstruct from a low-dimensional representation than abnormal observations.",,,0,not_related
"Contrarily to [12], we incorporate a third term LOLE that adds orthogonality constraints within the memory space.",,,1,related
We also use the same triplet loss Ltr introduced in [12].,,,1,related
