text,label_score,label,target_predict,target_predict_label
The inaccessibility of W∗ has also been discussed in the theory of lottery ticket hypothesis [56]–[58].,,,0,not_related
"Prior work [33] found that a winning ticket of one dense network can generalize across datasets and optimizers, beyond the original training setting where it was identified.",,,0,not_related
"[33, 3] studied the transferability of winning tickets between datasets; the former focuses on showing one winning ticket to generalize across datasets and optimizers; and the latter investigates LTH in large pre-trained NLP models, and demonstrates the winning ticket transferability across downstream tasks.",,,0,not_related
"The lottery ticket literature [8, 62, 34, 42, 10] regards a dense network as a set of hypotheses (subnetworks).",,,0,not_related
"As baselines, we consider Global (Morcos et al., 2019), Uniform (Zhu and Gupta, 2017), and Adaptive (Gale et al., 2019) pruning techniques and LAMP (Lee et al., 2021).",,,1,related
"Layerwise pruning ratio has also been investigated for NNs pruned at initialization since the explosion of the Lottery Ticket Hypothesis (Frankle and Carbin, 2019; Morcos et al., 2019).",,,0,not_related
"As baselines, we consider Global (Morcos et al., 2019), Uniform (Zhu and Gupta, 2017), and Adaptive (Gale et al.",,,1,related
(Morcos et al. 2019) showed successful results of model compression by generalized lottery ticket hypothesis across different benchmark datasets and popular DNN architectures.,,,0,not_related
Morcos et al. (Morcos et al. 2019) showed successful results of model compression by generalized lottery ticket hypothesis across different benchmark datasets and popular DNN architectures.,,,0,not_related
Morcos et al. (2019) studies the transferability of winning tickets between datasets and optimizers.,,,0,not_related
"[51, 50] showed those matching subnetworks to transfer between related classification tasks.",,,0,not_related
"…the performance of TabTransformer against following four categories of methods: (a) Logistic
regression and GBDT (b) MLP and a sparse MLP following (Morcos et al. 2019) (c) TabNet model of Arik and Pfister (2019) (d) and the Variational Information Bottleneck model (VIB) of Alemi et al. (2017).",,,1,related
regression and GBDT (b) MLP and a sparse MLP following (Morcos et al. 2019) (c) TabNet model of Arik and Pfister (2019) (d) and the Variational Information Bottleneck model (VIB) of Alemi et al.,,,1,related
"Although some of these recent works have tried to answer the question – how well do the tickets transfer across domains [38, 37], when it comes to vision tasks – the buck stops at image classification.",,,0,not_related
"[37, 38] show that winning tickets transfer well across datasets.",,,0,not_related
"However, the study in [37] was limited to smaller datasets, like CIFAR-10 and FashionMNIST, and both [37, 38] are limited to classification tasks.",,,0,not_related
"We also investigate the efficacy of methods introduced by [12, 38, 13, 42] such as iterative magnitude pruning, late resetting, early bird training, and layerwise pruning in the context of object recognition.",,,1,related
"This is in contrast with previous works related to ticket transfer in vision models [37, 38].",,,0,not_related
"[38] scrutinize the generalization properties of winning tickets and offer empirical evidence that winning tickets can be transferred across datasets and optimizers, in the realm of image classification.",,,0,not_related
[28] observed that an existing set of winning tickets from a dataset can be applied to a different dataset and with good performance.,,,0,not_related
(2019) explore a number of other interesting questions [69]:,,,0,not_related
"Morcos et al.(2019) carry out experiments in which lottery tickets are identified using one optimizer, ADAM (adaptive moment estimation), and then utilise a different optimizer, SGD (Stochastic Gradient Descent) with momentum, and vice versa on the CIFAR10 data.",,,0,not_related
"in general, winning tickets are optimizer independent [69].",,,0,not_related
"Morcos et al.(2019) explore a number of other interesting questions [69]: • Are the lotteries found for one image classification task
transferable to other tasks?",,,0,not_related
"Furthermore, other work has shown that such subnetworks generalize well across datasets and tasks (Morcos et al., 2019).",,,0,not_related
"As an additional experiment, we test whether LAMP can provide a general-purpose layerwise sparsity for pruning schemes other than MP.",,,1,related
"With the effectiveness of LAMP confirmed, we take a closer look at the layerwise sparsity discovered by LAMP.",,,1,related
"One common method is the global MP criteria (see, e.g., Morcos et al. (2019)), ∗Work done at KAIST 1i.e., simultaneously training and pruning
ar X
iv :2
01 0.",,,1,related
"Lastly, we observe that the heuristic of Gale et al. (2019) seems to provide an improvement over the Uniform MP.",,,1,related
"5, we plot the layerwise survival rates and the number of nonzero weights discovered by iteratively pruning VGG-16 (trained on CIFAR-10), by Global MP, Erdős-Rényi kernel, and LAMP.",,,1,related
"In Section 4, we empirically validate the effectiveness and versatility of LAMP.",,,1,related
"We note that the gap between one-shot pruning and iterative pruning is quite small for LAMP; when 1.15% of all prunable weights survive, iterative LAMP brings only 1.09% accuracy gain over one-shot LAMP.",,,1,related
"First, the right-hand side is free of any activation function, and is equivalent to the layerwise MP.",,,0,not_related
"Frankle & Carbin (2019) combine MP with weight rewinding to discover efficiently trainable subnetworks: for small nets, the authors employ uniform layerwise sparsity, but use different rates for convolutional layers and fully-connected layers (with an added heuristic on the last fully-connected layer); for larger nets, authors use global MP. Morcos et al. (2019) consider transferring the “winning ticket” initializations, using the global MP. Evci et al. (2020) proposes a training scheme for sparsely initialized neural networks, where the layerwise sparsity is given by the Erdős-Rényi kernel method; the method generalizes the scheme initially proposed by Mocanu et al. (2018) to convolutional neural networks.",,,0,not_related
"A global threshold on the weight magnitudes is imposed on every layer to meet the global sparsity constraint, and the layerwise sparsity is automatically determined according to this threshold; see, e.g., Morcos et al. (2019).",,,0,not_related
"In search of a “go-to” layerwise sparsity for MP, we take a model-level distortion minimization perspective towards MP.",,,1,related
"We then observe that the problem can be relaxed to the minimization of Frobenius distortion in the weight tensor, whose solution coincides with the layerwise MP. Formally, let ξ ∈ Rn be an input vector to a fully-connected layer with the weight tensor W ∈ Rm×n.",,,1,related
"We sort and prune as in global MP, taking O(n log n) steps.7
We observe that step 4 is the dominant term, which is shared by the global MP.",,,1,related
"…convolutional layers and fully-connected layers (with an added heuristic on the last fully-connected layer); for larger nets, authors use global MP. Morcos et al. (2019) consider transferring the “winning ticket” initializations, using the global MP. Evci et al. (2020) proposes a training scheme…",,,0,not_related
"Morcos et al. (2019) consider transferring the “winning ticket” initializations, and observe that global MP tend to work better with weight rewinding.",,,0,not_related
"A global threshold on the weight magnitudes is imposed on every layers to meet the global sparsity constraint, and the layerwise sparsity is automatically determined according to this threshold; see, e.g., Han et al. (2015); Morcos et al. (2019).",,,0,not_related
"Morcos et al. (2019); Sabatelli, Kestemont, and Geurts (2020) showed that LTs trained on large datasets transfer to smaller ones, but not vice versa.",,,0,not_related
"Given the close relationship between LTs and pruning solutions, the observation that LTs trained on large datasets transfer to smaller ones, but not vice versa (Morcos et al. 2019; Sabatelli, Kestemont, and Geurts 2020) can be explained by a common observation in transfer learning: networks trained in large datasets transfer to smaller ones.",,,0,not_related
"…relationship between LTs and pruning solutions, the observation that LTs trained on large datasets transfer to smaller ones, but not vice versa (Morcos et al. 2019; Sabatelli, Kestemont, and Geurts 2020) can be explained by a common observation in transfer learning: networks trained in large…",,,0,not_related
"CNN-based architectures such as VGG and ResNet) (Morcos et al. 2019), Reinforcement Learning and Natural Language Processing tasks (Yu et al. 2020).",,,0,not_related
"CNN-based architectures such as VGG and ResNet) (Morcos et al. 2019), Reinforcement Learning and Natural Language Processing tasks (Yu et al.",,,0,not_related
"In deeper networks, it
has been shown that IMP with late-rewinding (Frankle et al. 2019; Morcos et al. 2019) is more beneficial than rewinding to initialization.",,,0,not_related
"In practice however, pruning a large fraction of weights through one-shot pruning might null the weights that are actually important to the model leading to a significant drop in the performance (Morcos et al. 2019).",,,0,not_related
has been shown that IMP with late-rewinding (Frankle et al. 2019; Morcos et al. 2019) is more beneficial than rewinding to initialization.,,,0,not_related
"Furthermore, other work has shown that such subnetworks generalize well across datasets and tasks (Morcos et al. (2019); Tanaka et al. (2020)).",,,0,not_related
So it is not surprising to see that Figure A1 in [32] show evidence that the method may pass the layerwise rearrange check.,,,0,not_related
"(9)In the paper [32]’s Appendix A2 part, the authors report applying layerwise rearrange can hurt the performance when the pruning ratio is high.",,,1,related
"Similar trends are also reported in Figure 3 of [41], Figure 1b of [32] and Figure 11 of [11].",,,0,not_related
"In practice, sparse networks are mainly produced by the network pruning technique [13, 11, 21, 24, 9, 45, 16, 35, 34, 28], to name a few.",,,0,not_related
"Also, the relation of robustness, generalization, and pruning is a popular topic in many studies (Xu and Mannor 2012; Morcos et al. 2019; Arora et al. 2018).",,,0,not_related
"2020), and imposing weights sparsity (Arora et al. 2018; Morcos et al. 2019; Bartoldson et al. 2020).",,,0,not_related
"Note that, in addition to the polynomial terms, the relationship between accuracy and model sparsity is further modeled through an additional exponential term – a reasonable modeling assumption supported by prior knowledge of accuracy-sparsity curves in the pruning literature [9, 12, 25, 38, 31, 1, 10].",,,0,not_related
"Thus, for example, neural networks (NN) [33], which require many training samples, are not used in our solution, because the cost of collecting so many samples is prohibitive for HPC workflows.",,,0,not_related
"However, the intriguing prospect of ticket transfer [14] could provide such initializations right at the onset of training.",,,0,not_related
"In that case, winning tickets could be transferred and trained on new tasks, even directly from their extremely lightweight versions [14].",,,0,not_related
[20] evaluated the possibility to transfer the found tickets across optimizers or datasets.,,,0,not_related
"Question 2: Are there patterns in the transferability of winning tickets? For example, do winning tickets transfer better from tasks with larger training sets [21] or tasks that are similar?",,,0,not_related
"However, the resulting subnetworks transfer between related tasks [21, 22].",,,0,not_related
"However, these subnetworks must be initialized to the state of the network θi after i steps of training [16, 21, 17] rather than to initialization θ0.",,,0,not_related
[21] and Mehta [22] show that matching subnetworks transfer between vision tasks.,,,0,not_related
"In a similar setting, as demonstrated in the model pruning literature [7, 10, 26, 33, 38], having different pruning ratios for different layers of the network can further improve results over a single ratio across layers.",,,0,not_related
"…algorithm to find sparse subnetworks (winning tickets) within a dense, randomly initialized feedforward neural network, which can achieve comparable (and sometimes greater) performance to the original network, when trained separately (Frankle & Carbin, 2018; Zhou et al., 2019; Morcos et al., 2019).",,,0,not_related
"In this regard, the lottery ticket hypothesis (Frankle & Carbin, 2018), suggested an algorithm to find sparse subnetworks (winning tickets) within a dense, randomly initialized feedforward neural network, which can achieve comparable (and sometimes greater) performance to the original network, when trained separately (Frankle & Carbin, 2018; Zhou et al., 2019; Morcos et al., 2019).",,,0,not_related
"It is potentially transferable across vision tasks (Morcos et al., 2019).",,,0,not_related
"These include challenging the need for unstructured, magnitude-based pruning [59], using learning rate warmup [16], selecting unimportant weights globally instead of layer by layer [16], and late resetting unpruned parameters to values achieved early in training, as opposed to rewinding the weights all the way to their initial values [17, 38].",,,0,not_related
"Additionally, preliminary evidence for LT transferability has been provided in both natural and non-natural image domains [38, 45].",,,0,not_related
"On the other hand, lottery tickets have been shown to possess generalization properties that allow for their reuse across similar tasks, thus reducing the computational cost of finding dataset-dependent sparse sub-networks [38, 45].",,,0,not_related
Morcos et al. (2019) even showed that to some extent winning tickets can be transferred across different tasks and optimizers.,,,0,not_related
"In part, foresight pruning is motivated by evidence that specific sparse networks can be trained to yield comparable performance to the corresponding dense model (Liu et al., 2019; Frankle & Carbin, 2019; Morcos et al., 2019).",,,0,not_related
"A recent trend proposed to prune during training time (Frankle and Carbin, 2019; Gomez et al.; Desai et al., 2019; Morcos et al., 2019), yielding an iterative process.",,,0,not_related
"Generally, research sped up the process of finding winning tickets (Morcos et al., 2019; Yin et al., 2020).",,,0,not_related
"Orthogonally, Morcos et al. (2019) or Desai et al. (2019) study whether winning tickets transfer across tasks or datasets.",,,0,not_related
"Iterative Magnitude Pruning (IMP) is a recently proposed pruning algorithm that has proven to be successful in finding extremely sparse trainable neural networks at initialization (winning lottery tickets) [10, 11, 12, 44, 45, 46, 47].",,,0,not_related
"Moreover, its been shown that some of these winning ticket subnetworks can generalize across datasets and optimizers [12].",,,0,not_related
"This theory sparked a body of research examining the behaviour and obtainment of these winning tickets [18, 76, 54, 13, 15, 79, 17, 50], as well as some criticism [47, 19].",,,0,not_related
"[15] focused on the natural image domain, we investigate the possibility of transferring winning tickets obtained from the natural image domain to datasets in non natural image domains.",,,1,related
"However, it also appears that there are stronger limitations to the transferability of winning initializations which were not observed by [15].",,,0,not_related
"The results obtained on the artistic datasets seem to suggest that winning initializations contain inductive biases that are strong enough to get at least successfully transferred to the artistic domain, therefore confirming some of the claims that were made in [15].",,,0,not_related
"Besides the work presented in [15], there have been other attempts that aimed to better understand the LTH after studying it from a transfer-learning perspective.",,,0,not_related
"However, just as the study presented in [15], all this research limited its analysis to natural images.",,,0,not_related
"5, one research direction in particular has looked into how well winning ticket initializations can be transferred among different training settings (datasets and optimizers), an approach which aims at characterizing the winners of the LTH by studying to what extent their inductive biases are generic [15].",,,0,not_related
We follow an experimental set-up which is similar to the one that was introduced in [15] (and that has been validated by [5]).,,,1,related
"Following [6, 15], 31 winning tickets f(x;m θk) of increasing sparsity are obtained from each of these three datasets by repeating 31 iterations of network",,,0,not_related
"The closest approach to what has been presented in this work is certainly [15], which shows that winning models can generalize across datasets of natural images and across different optimizers.",,,0,not_related
"Constructing a winning ticket with parameters θk, instead of θ0, is a procedure which is known as late-resetting [4], and is a simple but effective trick that makes it possible to stably find winning-initializations in deep convolutional neural networks [4, 15].",,,0,not_related
"The “winning” initializations were shown to generalize across computer vision datasets (Morcos et al., 2019), and to exist both in LSTM and Transformer models for NLP tasks (Yu et al., 2020).",,,0,not_related
"The “winning” initializations were shown to generalize across computer vision datasets (Morcos et al., 2019), and to exist both in LSTM and Transformer models for NLP tasks (Yu et al.",,,0,not_related
"Recently, several works have suggested the use of rewound weights from the original network as initializations [9,34,55].",,,0,not_related
[37] proposed a generalization method which allows reusing the same wining tickets across various datasets.,,,0,not_related
Morcos et al. (2019) show that these subnetworks transfer across tasks and datasets.,,,0,not_related
"The lottery ticket hypothesis was latter analyzed in several contexts [36], [37], [38].",,,0,not_related
"(14)We might consider finding a lottery ticket for BERT, which we would expect to fit the GLUE training data just as well as pre-trained BERT (Morcos et al., 2019; Yu et al., 2019).",,,1,related
"14We might consider finding a lottery ticket for BERT, which we would expect to fit the GLUE training data just as well as pre-trained BERT (Morcos et al., 2019; Yu et al., 2019).",,,1,related
[33] proposed a technique for sparsifying n over-parameterized trained neural model based on the lottery hypothesis.,,,0,not_related
"Lottery ticket mechanism since has been further explored, it has been shown that the winning tickets can be used across datasets [11], and that the tickets occur in other domains as well, such as in NLP [12].",,,0,not_related
"Mainly, we answer the question: As is recently discovered for generic lottery ticket mechanism [11], that a winning ticket can generalize across datasets, can we extend this notion to DPLTM? Where we can use a publicly available dataset to get a winning ticket in a non-private setting, and then use that winning ticket to train a differentially private model on our sensitive dataset.",,,1,related
"Similar to the experimental setup in [5], we divide the Cifar-10 dataset into two equal training splits namely Cifar-10a and Cifar-10b with 25k training samples in each,",,,1,related
"It was found in [5] that global pruning outperforms local pruning when the larger networks are considered, and hence we adopt global pruning for this case as well.",,,1,related
"Similarly, in [5], the authors reported that the winning tickets generalized reasonably across changes in the training con guration.",,,0,not_related
"In a recent study [5], it was found through extensive experimentation that the winning ticket initializations could be reused and are generalizable across models trained on di erent datasets and optimizers.",,,0,not_related
"Following this pivotal work, several studies have been carried to understand the role of initialization, the e ect of the pruning criterion used and the importance of retraining the sub-networks [3, 4, 5, 6, 7, 8] for the success of lottery tickets.",,,0,not_related
"To this end, we adopt a setup similar to [5]: we investigate the transferability of tickets to di erent datasets from the same distribution.",,,1,related
"For experiments with VGG-19 [33], we use its modi ed variant as in [5, 2], i.",,,1,related
"Note, this observation is consistent with results from earlier works on LTH such as [2, 5].",,,1,related
[14] (multilayer perceptron (MLP) is replaced by a fully connected layer).,,,0,not_related
"[14] show that winning tickets initializations transfer across different image classification datasets, thus suggesting that winning tickets do not entirely overfit to the particular data distribution on which they are found.",,,0,not_related
[14] have shown that winning tickets initializations can be re-used across different datasets with a common domain (natural images) trained on the same task (labels classification).,,,0,not_related
1 of [151].,,,0,not_related
"Morcos et al. (2019) show that subnetworks found by IMP with rewinding transfer between vision tasks, meaning the effort of finding a subnetworks can be amortized by reusing it many times.",,,0,not_related
In our work we use global pruning as used in the paper we are reproducing [4].,,,1,related
The authors [4] empirically demonstrate that the structure of the subnetwork contains significant information.,,,0,not_related
The authors of the original paper [4] did not release their code.,,,1,related
We use hyperparameters provided by authors to maintain consistency with the paper we are reproducing [4].,,,1,related
We employ late resetting of 1 epoch in all the experiments as used by the authors [4].,,,1,related
"As a part of the NeurIPS Reproducibility Challenge’s Replication Track, we replicate the work done by [4] and investigate if the winning ticket initializations are generalizable across datasets and optimizers.",,,1,related
"The paper we reproduce, ""One ticket to win them all: generalizing lottery ticket initializations across datasets and optimizers"" [4] provides empirical evidence that these winning ticket initializations generalize across multiple datasets as well as optimizers1.",,,1,related
"For implementing the random ticket baseline, we generate random masks by globally permuting the winning masks as mentioned in [4].",,,1,related
"The initializations, number of epochs, learning rate annealing schedules are in accordance to [4] to maintain consistency of experiments.",,,0,not_related
1Authors used anywhere in this paper refers to the authors of the paper that we reproduce [4] 2The code base can be found at github.,,,1,related
"2a), which helps to decide which ‘tickets’ (components) generalize and transfer model-knowledge [25] or specialize it.",,,0,not_related
Lottery tickets (LTs) have been show to generalize well to new tasks [44].,,,0,not_related
"Morcos et al. (2019) investigate the transferability of lottery tickets across multiple optimizers and datasets for supervised image classification, showing that tickets can indeed generalize (Morcos et al., 2019).",,,0,not_related
"…of the lottery ticket hypothesis—has shown that sparse networks can be, under certain conditions, easier to optimize (Frankle and Carbin, 2019; Morcos et al., 2019; Gale et al., 2019); and (2) sparser subnetworks have significantly less capacity than their large, over-parameterized…",,,0,not_related
"In contrast, Morcos et al. (2019) transfers the entire ticket (sparse masks and initial values) to the target domain.",,,0,not_related
"(2019) investigate the transferability of lottery tickets across multiple optimizers and datasets for supervised image classification, showing that tickets can indeed generalize (Morcos et al., 2019).",,,0,not_related
"In Morcos et al. (2019), the authors refer to the transfer of initialization as both the transfer of the sparse topologies and the transfer of the initial values of the subnetworks.",,,0,not_related
", 2018b); and (2) if tickets can generalize across multiple datasets (Morcos et al., 2019).",,,0,not_related
"In particular, (1) whether keeping the same initialization (e.g., θ0) is crucial for acquiring tickets (Liu et al., 2018b); and (2) if tickets can generalize across multiple datasets (Morcos et al., 2019).",,,0,not_related
"…are a lot of parameter redundancy in trained deep model and recent lottery ticket hypothesis (Frankle & Carbin, 2019; Frankle et al., 2019; Zhou et al., 2019; Morcos et al., 2019) shows that a subnetwork in the trained model, if trained alone, could achieve comparable or even better generalization.",,,0,not_related
", 2015) shows there are a lot of parameter redundancy in trained deep model and recent lottery ticket hypothesis (Frankle & Carbin, 2019; Frankle et al., 2019; Zhou et al., 2019; Morcos et al., 2019) shows that a subnetwork in the trained model, if trained alone, could achieve comparable or even better generalization.",,,0,not_related
" 2016; Han et al., 2015) shows there are a lot of parameter redundancy in trained deep model and recent lottery ticket hypothesis (Frankle &amp; Carbin, 2019; Frankle et al., 2019; Zhou et al., 2019; Morcos et al., 2019) shows that a subnetwork in the trained model, if trained alone, could achieve comparable or even better generalization. Based on our analysis, the intuition to explain both sides of the empirical evi",,,0,not_related
