text,label_score,label,target_predict,target_predict_label
"A finding that suggests a network that is pruned by magnitude consists of an optimal substructure of the original network, known as “lottery ticket hypothesis”, was presented in [11], [14].",,,0,not_related
The ability that we can find lottery tickets is useful when we need to retrain a pruned model on slightly different but similar datasets [14].,,,1,related
"To verify whether the final model from adaptive pruning is a lottery ticket [11], [14], we reinitialize this converged model using the original random seed, and compare its accuracy vs.",,,1,related
The lottery ticket is useful for retraining a pruned model on a different yet similar dataset [14].,,,0,not_related
"However, finding winning tickets hinged on costly (iterative) pruning and retraining (Morcos et al., 2019) studies the reuse of winning tickets, transferable across different datasets.",,,0,not_related
"(Morcos et al., 2019) studies the reuse of winning tickets, transferable across different datasets.",,,0,not_related
"Moreover, they can be transferred between datasets [16, 17] and training methods [15].",,,0,not_related
"These have already found applications in, for example, transfer learning [15, 16, 17], making ticket search a problem of independent interest.",,,0,not_related
Morcos et al. (2019) confirm the findings on the efficacy of global pruning and late resetting.,,,0,not_related
"Although hard to find in larger regimes, when found, lottery tickets have been shown to possess generalization properties that allow for their reuse in similar tasks, thus reducing the computational cost of finding task- and dataset-dependent sparse sub-networks (Morcos et al., 2019).",,,0,not_related
"The Lottery Ticket Hypothesis (LTH) proposed in (Frankle & Carbin, 2019) also shows that a sparse subnetwork with comparable performance to the dense model can be found via a combination of IMP and weight resetting (Frankle & Carbin, 2019; Morcos et al., 2019).",,,0,not_related
"In LTH, first a large network is trained and pruned to be a small subnetwork S, then retraining S using its original initialization yields comparable or even better performance, while retraining S with a different initialization performs much worse.",,,0,not_related
"Other empirical observations like lottery ticket hypothesis (LTH) [11; 24; 30; 35], recently also verified in CL [5], may also be explained similarly.",,,0,not_related
"For LTH, our explanation is that S contains weights that are initialized luckily, i.e., close to useful local optima and converge to them during training.",,,1,related
"[24] Ari Morcos, Haonan Yu, Michela Paganini, and Yuandong Tian.",,,0,not_related
"Then, each layer density is automatically generated based on this ratio through the algorithm described in the research (Morcos et al., 2019).",,,0,not_related
"(Morcos et al., 2019; Chen et al., 2020; 2021a;b) studied the transferability of winning tickets between datasets, tasks and architectures.",,,0,not_related
"We also noticed is that the winning tickets identified from a larger dataset usually have better transferability, which is in accordance with (Morcos et al., 2019).",,,1,related
"Several pioneer works (Mehta, 2019; Morcos et al., 2019; Desai et al., 2019; Chen et al., 2020b;a) also investigate LTH transferability across datasets and downstream tasks.",,,0,not_related
"However, at extremely high sparsity, the performance of transferring tickets degrades faster than the winning tickets identified on the target datasets, corresponding to the observations from previous studies (Chen et al., 2020c; Morcos et al., 2019; Chen et al., 2021e).",,,0,not_related
"The kind of tolerance, combined with the proven generalizability of winning tickets across different tasks, models, and datasets (Morcos et al., 2019), with more efficient methods of finding the winning tickets become available (Tanaka et al., 2020; You et al., 2020).",,,0,not_related
"The kind of tolerance, combined with the proven generalizability of winning tickets across different tasks, models, and datasets (Morcos et al., 2019), with more efficient methods of finding the winning tickets become available (Tanaka et al.",,,0,not_related
"331 [35] Ari S Morcos, Haonan Yu, Michela Paganini, and Yuandong Tian.",,,0,not_related
"In [4, 35] 61 a ""lottery ticket hypothesis"" was proposed that with an optimal substructure of the neural network 62 acquired by weights pruning, directly training a pruned model could reach similar results as pruning 63 a pre-trained network.",,,0,not_related
"Jump-Start is motivated by the work of [22], which found that an LTN trained on one image classification dataset can be finetuned to other datasets without much loss in accuracy.",,,0,not_related
"In addition to supervised image classification, LTH has been explored widely in numerous contexts, such as natural language processing [35, 36], reinforcement learning [37, 38], pre-training/transfer learning [39, 40, 41], and efficient training [42, 43].",,,0,not_related
"a small subnetwork, by studying stabilization [9] and generalization [23].",,,0,not_related
"Meanwhile, [7, 8, 12, 49, 54] thoroughly investigate the transferability of such intriguing matching subnetworks.",,,0,not_related
"LTH has been explored extensively in practice and was shown to be applicable in even large-scale settings [8, 21, 22, 42, 48, 70, 71].",,,0,not_related
"[48] Ari S Morcos, Haonan Yu, Michela Paganini, and Yuandong Tian.",,,0,not_related
"In recent years, researchers have found an intriguing corollary: winning tickets found in the context of one task can be transferred to related tasks [3, 4, 8, 18, 28, 29, 37, 39], possibly even across different architectures [7].",,,0,not_related
"understanding of the universality in behavior near phase transitions, as well as a way in which to characterize materials by such behavior, we reasoned that viewing the IMP from an RG perspective may lead to new insight on the universality of winning tickets [3, 4, 8, 18, 28, 29, 37, 39] and the general success it has found in the study of DNNs [16].",,,0,not_related
"It requires several tricks to find lottery tickets for complicated architectures (Morcos et al., 2019).",,,0,not_related
"Following that, a few works (Morcos et al., 2019; Mehta, 2019) have explored LTH in transfer learning.",,,0,not_related
"Inspired by the recent observation that training with more classes helps consolidate a more robust sparse model (Morcos et al., 2019), we propose a curriculum pruning schedule, in which IMP is conducted more aggressively for new tasks arriving later, with n(i) ≥ n(i−1), until reaching the desired…",,,1,related
"(Mehta, 2019; Morcos et al., 2019; Desai et al., 2019) pioneer to study the transferability of the ticket identified on one source task to another target task, which delivers insights on one-shot transferability of LTH.",,,0,not_related
"Inspired by the recent observation that training with more classes helps consolidate a more robust sparse model (Morcos et al., 2019), we propose a curriculum pruning schedule, in which IMP is conducted more aggressively for new tasks arriving later, with n ≥ n(i−1), until reaching the desired sparsity.",,,1,related
"Since their introduction, a number of works have attempted to understand various aspects of this phenomenon, including their transferability (Morcos et al., 2019), the factors which make particular winning tickets good (Zhou et al.",,,0,not_related
"Should all layers be pruned equally? Or rather, should some layers be pruned more than others? Previous studies have shown that global pruning results in better compression and performance than layerwise (or uniform) pruning (Frankle & Carbin, 2018; Morcos et al., 2019).",,,0,not_related
"We used global iterative magnitude pruning (IMP) for LTs because it has been shown to perform better than one shot pruning, where the pruning procedure is only done once rather than iteratively, and local (or uniform layerwise) pruning, where each layer has the same pruning ratio (Morcos et al., 2019; Frankle & Carbin, 2018).",,,1,related
"Since their introduction, a number of works have attempted to understand various aspects of this phenomenon, including their transferability (Morcos et al., 2019), the factors which make particular winning tickets good (Zhou et al., 2019), and linear mode connectivity (Frankle et al., 2019b).",,,0,not_related
"…pruning (IMP) for LTs because it has been shown to perform better than one shot pruning, where the pruning procedure is only done once rather than iteratively, and local (or uniform layerwise) pruning, where each layer has the same pruning ratio (Morcos et al., 2019; Frankle & Carbin, 2018).",,,0,not_related
"Epoch 2 was chosen to be roughly similar to experiments in Morcos et al. (2019), which showed strong winning ticket performance across a number of datasets.",,,0,not_related
"Previous studies have shown that global pruning results in better compression and performance than layerwise (or uniform) pruning (Frankle & Carbin, 2018; Morcos et al., 2019).",,,0,not_related
"이 런 문제를 극복하고자 프루닝을 학습이 다 끝나지 않은 상태에서 약간의 에폭(Epoch) 이후 프루닝을 일정부분 해주고, 다시 몇 번의 에폭을 반복하는 방법[23]과 수식 을 통한 중요 뉴런을 근사 계산하여 해당중요 뉴런만 남기고 프루닝 하는 방법[16]이 있다.",,,0,not_related
"A great body of work [3, 4, 5, 6, 7, 8, 9, 10, 11, 12, 14, 15, 16] has been dedicated to this task.",,,0,not_related
"Furthermore, other work has shown that such subnetworks generalize well across datasets and tasks (Morcos et al. (2019); Tanaka et al. (2020)).",,,0,not_related
"In a similar setting, as demonstrated in the model pruning literature (Gordon et al., 2018; Liu et al., 2019b; Morcos et al., 2019; Renda et al., 2020), having different pruning ratios for different layers of",,,0,not_related
"In a similar setting, as demonstrated in the model pruning literature (Gordon et al., 2018; Liu et al., 2019b; Morcos et al., 2019; Renda et al., 2020), having different pruning ratios for different layers of
the network can further improve results over a single ratio across layers.",,,0,not_related
The success of the LT algorithm also spawned research in the area of better initialization methods based on determining winning tickets across di erent data sets [36].,,,0,not_related
"…lottery ticket hypothesis (LTH) (Frankle & Carbin, 2019) advocates that dense models contain highly sparse subnetworks, i.e., winning tickets, with the same good trainability, expressiveness, and transferability (Morcos et al., 2019a; Chen et al., 2020b;a) compared to their dense counterpart.",,,0,not_related
Similar observations also presented in Morcos et al. (2019a).,,,0,not_related
"…advocated the existence of sparse subnetworks (winning tickets) with comparable transferability to the full dense models (Chen et al., 2020b;a; Koohpayegani et al., 2020; Morcos et al., 2019b; Chen et al., 2022a) and adversarial robustness (Chen et al., 2022b; Gui et al., 2019; Ye et al., 2019).",,,0,not_related
"(4) Compression w.r.t. transferability: extensive investigations (Chen et al., 2020b;a; Koohpayegani et al., 2020; Morcos et al., 2019b; Iofinova et al., 2022) indicate that there exist high quality subnetworks with competitive or even enhanced transferability across diverse datasets.",,,0,not_related
"…et al., 2019; 2020b; Gui et al., 2019; Ye et al., 2019; Wang et al., 2018; Zhou et al., 2009; Venkatesh et al., 2020; Chen et al., 2020b;a; Koohpayegani et al., 2020; Morcos et al., 2019b; Zhang et al., 2021a; Sakamoto & Sato, 2022; Chen et al., 2022c) trying to address some part of this question.",,,0,not_related
