text,label_score,label,target_predict,target_predict_label
"Further, [23] studied transfer learning with winning tickets, [24] explored the generalization of lottery ticket initializations for efficient downstream adaptation, and [25] proposed inducing adversarial robustness within the transfer learning pipeline as a means of improving transferability.",,,0,not_related
[5] [33] pooled all layers together and determined pruning thresholds for different layers in an integrated fashion.,,,0,not_related
"Given non-standardized adoption of CNN models for experimentations in post-training pruning works, we examined as most models as appeared in various literature and add those as baselines in our comparison, including Global [33], Uniform [45], Uniform+ [13], LAMP [25], ER ker.",,,1,related
[109] find OneTicket that can generalize across a variety of datasets and optimizers within the natural image domain.,,,0,not_related
"[109] observe that for image classification, winning tickets generated on larger datasets (such as bigger training set size and/or more number of classes) consistently transferred better than those generated with smaller datasets.",,,0,not_related
"However, this kind of method is not friendly to those significant weights whose importance is not immediately apparent at the beginning [109].",,,0,not_related
"(2) Some literature ([67, 109, 110, 111]) studies the transferability of a winning ticket found in a source dataset to another dataset, which provides insights into the transferability of LTH.",,,0,not_related
"Work by Morcos et al.[18] has already shown that for certain tasks such as computer vision, winning tickets can be transferred across different tasks/models.",,,0,not_related
"In fact, transferability of winning lottery tickets has been shown in several fields [16],[17],[18] including across networks with different architectures [19].",,,0,not_related
"Inspired by [47], we conduct experiments to study the transferability of FSTs.",,,1,related
"This is because FSTs drawn from large datasets are less likely to suffer from overfitting, which is consitent with [47].",,,0,not_related
"Given the fact that CNN models are generally overparameterized, many works [11, 37, 39, 50] have demonstrated a sparse sub-network can still reach the accuracy comparable to the original dense network and many channels in each layer can be taken away without harming the performance.",,,0,not_related
We take inspiration by the work of Morcos et al. (2019) and re-train sparse initializations generated for one task-ES configuration on a different setting with a shared network architecture.,,,1,related
"Specifically, it has been shown that the winning ticket can be transferred between datasets and tasks [19, 47, 13, 57].",,,0,not_related
"Other works demonstrated the generality of the winning ticket and showed that a single pruned network can be transferred across datasets and achieve good performance after fine-tuning [19, 47, 13] and even that LT can be used for non-natural datasets [57].",,,0,not_related
Another study [13] conducted experiments to demonstrate,,,0,not_related
"In the natural image domain, Morcos et al. (2019) finds that the winning ticket initializations generalize across a variety of vision benchmark datasets.",,,0,not_related
"1) Experiment Setup: To answer the RQ3, we select 4 state-of-the-art model compression techniques proposed in the last two years (i.e., LAMP [30], Global [31], Uniform+ [32] and ERK [33]) to see whether our DeepArc framework can speed up the model compression efficiency.",,,1,related
", LAMP [30], Global [31], Uniform+ [32] and ERK [33]) to see whether our DeepArc framework can speed up the model compression efficiency.",,,0,not_related
"In the field of transferring sparse pretrained models, several works have explored the effect of different unstructured pruning techniques during pretraining on transfer performance (Mehta, 2019; Morcos et al., 2019; Paganini & Forde, 2020b; Sabatelli et al., 2020; Sun et al., 2022; Liu et al., 2022).",,,0,not_related
"…the field of transferring sparse pretrained models, several works have explored the effect of different unstructured pruning techniques during pretraining on transfer performance (Mehta, 2019; Morcos et al., 2019; Paganini & Forde, 2020b; Sabatelli et al., 2020; Sun et al., 2022; Liu et al., 2022).",,,0,not_related
"For example, there have been many attempts at pruning convolutional neural networks (CNNs) which include the original paper on lottery tickets itself [6] (80–90% prune rate), a generalized approach [7] to prune across many vision datasets (such as MNIST, SVHN, CIFAR-10/100, ImageNet, and Places365), and an object detection variant [8] pruned up to 80%.",,,0,not_related
"Second, in the generalized work on pruning CNNs [7] they mention larger datasets tend to produce better lottery tickets.",,,0,not_related
"Presented at the Sparsity Workshop at the 11 th International Conference on Learning Representations , Kigali, Rwanda, 2023.
cost (Morcos et al., 2019) including memory consumption and inference time, and additionally enable wide-spread democratization of DNN’s with a low carbon footprint.",,,0,not_related
"cost (Morcos et al., 2019) including memory consumption and inference time, and additionally enable wide-spread democratization of DNN’s with a low carbon footprint.",,,0,not_related
"This includes the transferability of lottery tickets between different datasets [37, 38, 39, 40, 41, 42] and even between different models [43].",,,0,not_related
[110] illustrated the computational expense of determining winning tickets in the lottery ticket hypothesis.,,,0,not_related
"Finally, the resulting ⊙ is the winning ticket of the LTH by using the surrogate dataset.",,,1,related
transferable to the target task on the basis of the observations in a previous study [7].,,,0,not_related
"The LTH [3, 7, 16] claims that randomly initialized overparametrized DNNs can contain certain sub-networks called winning tickets that can achieve comparable test accuracy of the original DNNs, even with smaller parameter size of the networks.",,,0,not_related
The pre-training stage finds the winning ticket of the LTH through pruning the original model after training using the surrogate dataset.,,,1,related
The server has a surrogate dataset to pre-train a model for finding the winning ticket of the LTH.,,,1,related
"We propose an FL method that initializes a model at the server by using the winning ticket of the LTH found with a surrogate dataset, as shown in Fig.",,,1,related
"Although realizations of the winning ticket depend on both the model and dataset used for the training, research showed that the winning tickets obtained from large datasets could be transferable to tasks on other datasets [7] in several cases.",,,0,not_related
We proposed and evaluated a communication-efficient FL method by imposing the LTH-based initialization with a surrogate dataset before the FL process.,,,1,related
"The LTH claims that randomly initialized DNNs contain smaller “good” sub-networks, called “winning tickets” that can attain similar performance as the original DNNs even with their smaller model sizes.",,,0,not_related
Li et al. proposed LotteryFL that integrates FL and the LTH [4].,,,0,not_related
"At the pre-training stage, a surrogate dataset is used to extract the sub-network of the original model, i.e., the winning ticket of the LTH, at the server.",,,1,related
"To address the issue, using sub-networks extracted from the original DNNs on the basis of the lottery ticket hypothesis (LTH) [3] has been proposed and investigated [4–6].",,,0,not_related
"from the winning ticket for the target task in general, findings on the winning tickets [7] suggest that the resulting ticket by a different dataset can be transferable to other tasks.",,,0,not_related
[22] elaborately discussed the generalizing and transferring capability of lottery tickets.,,,0,not_related
"Later [22], [39] improved the LTH idea.",,,0,not_related
"However, the transfer of weight initializations across datasets was first analyzed by [22].",,,0,not_related
[22] observed an intriguing fact about LTH regarding the transferability of lottery tickets.,,,0,not_related
[22]: Winning tickets are computationally expensive to generate because of the repetitive train-prune-rewind cycle.,,,0,not_related
[21] and [22] have shown that random tickets with and without masking preserved results in lower performance than winning tickets with equal parameters.,,,0,not_related
Later works like [22] demonstrate that these tickets generated from one dataset can even be transferred to another and achieve accuracies comparable to the original network.,,,0,not_related
"Pruning heuristics of our proposed method is motivated by previous work [21], [22].",,,1,related
"Such division is different from previous work done by [22], because they performed experiments by dividing Cifar-10 into parts where each part consisted of all ten classes.",,,0,not_related
"According to [22], both tickets from two separate partitions are transferable to the entire Cifar-100 dataset.",,,0,not_related
"Recent work has shown that LTP pruned models can generalize across a variety of datasets within an application domain as well as with different optimizers [12], [30].",,,0,not_related
ity property [30]; 2) The transferred tickets act as a regularizer and prevents overfitting while training [30]; and 3) winning tickets learn generic inductive biases which improve training.,,,0,not_related
"Empirical studies based on this statement show that NNs could potentially be significantly smaller without sacrificing accuracy (Chen et al., 2020; Frankle et al., 2019; Gale et al., 2019; Liu et al., 2018; Morcos et al., 2019; Zhou et al., 2019; Zhu and Gupta, 2017).",,,0,not_related
"Such winning tickets have demonstrated their abilities to transfer across tasks and datasets (Morcos et al., 2019; Yu et al., 2020; Desai et al., 2019).",,,0,not_related
"They have also not included a comparison of Global MP to SOTA algorithms [12], [13], [14], [15], [16], [17].",,,0,not_related
"prior works have used Global MP as a baseline [12], [13],",,,0,not_related
"Since the lottery hypothesis was put forward, much work has been done on expansion[3,6,28] and theoretical research[25,29].",,,0,not_related
"This outstanding work sparks an interest in the deep learning community, and numerous related PaI researches have emerged [4, 24, 26, 36, 39, 41].",,,0,not_related
Morcos et al. (2019) unveiled that the winning tickets discovered using larger datasets consistently transferred better than those generated using smaller datasets.,,,0,not_related
"Such cost poses several challenges for the research community: the training of a network model is associated to large carbon footprints and the commercialization of of AI research (especially for edge devices) is hindered by the resource requirements of the models Strubell et al. [2019]. For several years now, many works in literature have shown that is possible to shrink both the size and resource requirements, mainly via quantization Yang et al.",,,0,not_related
"Such cost poses several challenges for the research community: the training of a network model is associated to large carbon footprints and the commercialization of of AI research (especially for edge devices) is hindered by the resource requirements of the models Strubell et al. [2019]. For several years now, many works in literature have shown that is possible to shrink both the size and resource requirements, mainly via quantization Yang et al. [2020], Jin et al.",,,0,not_related
"Pruning can be performed either before training a model Lee et al. (2018); Wang et al. (2020), early in training Rachwan et al. (2022); You et al. (2020), or after the model has been fully trained Frankle et al. (2020a,b); LeCun et al. (1990); Morcos et al. (2019).",,,0,not_related
"A line of work [51,52,16,7] discover the existence of transferable winning tickets from source dataset and successfully transfer it to target dataset.",,,0,not_related
"To address this, a line of work [51,52,16,7] discover the existence of transferable winning tickets from source dataset and successfully transfer it to target dataset, thus eliminating search cost.",,,0,not_related
"Unfortunately, such techniques do not show comparable performance with the original IMP methods, thus mainstream LTH leverages IMP as a pruning scheme [25,83,52].",,,0,not_related
Most of the work investigating the use of sparse sparse training in RL are in the context of the lottery ticket hypothesis; Morcos et al. (2019) studied the existence of lucky sparse initializations using pruning and late-rewinding; Hasani et al. (2020) proposed an interesting approach by…,,,0,not_related
"(Chen et al., 2020b; Desai et al., 2019; Morcos et al., 2019; Mehta, 2019) investigate the transferability across different datasets (i.",,,0,not_related
"(Chen et al., 2020b; Desai et al., 2019; Morcos et al., 2019; Mehta, 2019) investigate the transferability across different datasets (i.e., dataset transfer), while other pioneers study the transferability of pre-trained tickets from supervised and self-supervised vision pre-training (Chen et al.,…",,,0,not_related
"In LTH, first a large network is trained and pruned to be a small subnetwork S, then retraining S using its original initialization yields comparable or even better performance, while retraining S with a different initialization performs much worse.",,,0,not_related
"Other empirical observations like lottery ticket hypothesis (LTH) (Frankle & Carbin, 2019; Morcos et al., 2019; Tian et al., 2019; Yu et al., 2020), recently also verified in CL (Chen et al.",,,0,not_related
"Other empirical observations like lottery ticket hypothesis (LTH) (Frankle & Carbin, 2019; Morcos et al., 2019; Tian et al., 2019; Yu et al., 2020), recently also verified in CL (Chen et al., 2021), may also be explained similarly.",,,0,not_related
"For LTH, our explanation is that S contains weights that are initialized luckily, i.e., close to useful local optima and converge to them during training.",,,1,related
"LTH [17] inspired many to study the transferability of the ""winning ticket"", or sparse subnetwork architecture in general, across domains [45, 47, 51].",,,0,not_related
"[45] showed that winning ticket initializations generalized across a variety of natural image datasets, suggesting that different tasks seem to enjoy the same sparse subnetwork structure.",,,0,not_related
"This phenomenon has been observed in multiple applications, including computer vision (Morcos et al., 2019; Frankle et al., 2020) and natural language processing (Gale et al.",,,0,not_related
"This phenomenon has been observed in multiple applications, including computer vision (Morcos et al., 2019; Frankle et al., 2020) and natural language processing (Gale et al., 2019; Yu et al., 2020).",,,0,not_related
[144] |Θ i | ✓ ✗ ✗ Datasets/Optimizers ✗ Zhang et al.,,,0,not_related
"resetting the weights to values reached early in the first, dense training [120, 144, 149].",,,0,not_related
"Costs for finding LTs via iterative magnitude pruning can be reduced by using early stopping and low precision training for each pre-training iteration [146], sharing LTs for different datasets and optimizers [144] or iteratively reducing the dataset together with the number of non-zero parameters [145].",,,0,not_related
"To overcome 143 this problem, Morcos et al. (2019) proposed to 144 transfer the WT structure from source tasks to re- 145 lated tasks in the computer vision (CV) field.",,,0,not_related
[75] proposed to use one generalized lottery tickets for all vision benchmarks and got comparable results with the specialized lottery tickets; Frankle et al.,,,0,not_related
"Other ways of reducing the computational cost include finding a good subnetwork and then fine-tuning (Sreenivasan et al., 2022b), and transferring lottery tickets (Morcos et al., 2019; Chen et al., 2021c).",,,0,not_related
", 2022b), and transferring lottery tickets (Morcos et al., 2019; Chen et al., 2021c).",,,0,not_related
The transferability of winning tickets has been investigated in [23].,,,0,not_related
"[23] Ari Morcos, Haonan Yu, Michela Paganini, and Yuandong Tian.",,,0,not_related
"In [8, 30] a ”lottery ticket hypothesis” was proposed that with an optimal substructure of the neural network acquired by weights pruning directly train a pruned model could reach similar results as pruning a pre-trained network.",,,0,not_related
"[30] Ari S Morcos, Haonan Yu, Michela Paganini, and Yuandong Tian.",,,0,not_related
"To evaluate our experiments, we perform three popular image classification tasks including MNIST handwritten digit recognition [6], CIFAR-10 image classification [26], and Fashion-MNIST fashion image classification [42].",,,0,not_related
"This view also provides an explanation of the empirically observed phenomenon that universal tickets achieve good performance across a number of tasks only at moderate sparsity levels and become more universal when trained on larger datasets (Morcos et al., 2019; Chen et al., 2020).",,,0,not_related
"The significant computational cost associated with finding good lottery tickets has motivated the quest for universal tickets that can be transferred to different tasks (Morcos et al., 2019; Chen et al., 2020).",,,0,not_related
"They propose an initialization scheme that extends standard approaches like He (He et al., 2015) or Glorot (Glorot & Bengio, 2010) initialization to non-zero biases and supports the existence of LTs while keeping the large mother network f0 trainable.",,,0,not_related
"The independence of the functions is not required and could be replaced by dictionaries, but the independence aids the compression of the bottom layers and thus our objective to find sparse LTs.",,,1,related
"Even though the function families above can be represented efficiently as LTs, we should mention that a big advantage of neural networks is that the actual function family can be learned.",,,0,not_related
"Before we can prove the existence of strong universal LTs, we have to formalize our notion of what makes a strong LT universal.",,,1,related
"To make meaningful progress in deriving a notion of universal LTs, we therefore need a stronger simplification.",,,1,related
"Independently from LTs, we discuss conditions when this is a promising approach, i.e., when the bottom layers of the deep neural network represent multivariate (basis) functions, whose linear combination can represent a large class of multivariate functions.",,,0,not_related
Theorem 3 (Multivariate LTs (single layer)).,,,0,not_related
"In the following, we discuss the existence of polynomial LTs in more detail.",,,1,related
"Next, we can utilize our improved LT pruning results to prove the existence of universal LTs.",,,1,related
"However, Morcos et al. (2019) posited the existence of so-called universal lottery tickets that, once identified, can be effectively reused across a variety of settings.",,,0,not_related
"It is therefore reasonable to transfer it to LTs (Morcos et al., 2019).",,,0,not_related
"[28], which shows that the winning ticket discovered from a dataset can be transferred to a highly relevant dataset.",,,0,not_related
"Ensuing work confirmed this, showing that winning tickets are able to perform well on a variety of tasks beyond the one that they were originally discovered on [8, 17, 29, 30, 37, 39].",,,0,not_related
"Given that the development of the RG led to a first principled understanding of universal behavior near phase transitions, as well as a way in which to characterize materials by such behavior, we reasoned that viewing IMP from an RG perspective may prove useful when studying the universality of winning tickets [4, 5, 8, 17, 29, 30, 37, 39] and the general success IMP has found as a tool for interrogating DNNs [15].",,,0,not_related
"In recent years, researchers have found an intriguing corollary: winning tickets found in the context of one task can be transferred to related tasks [4, 5, 8, 17, 29, 30, 37, 39], possibly even across architectures [7].",,,0,not_related
"…performance for different winning ticket sub-networks within the same dataset. on the other hand, the work of Ibrahim et al. (Alabdulmohsin et al. 2021; Morcos et al. 2019) shown the existence of winning ticket sub-networks with the ability to generalize across datasets and training policies.",,,0,not_related
(Alabdulmohsin et al. 2021; Morcos et al. 2019) shown the existence of winning ticket sub-networks with the ability to generalize across datasets and training policies.,,,0,not_related
"…2017) • A simple MLP model, created by removing layers from
the TabTransformer model (see (Huang et al. 2020), §3.1, paragraph 1)
• A sparse MLP, based on (Morcos et al. 2019) • TabTransformer (Huang et al. 2020) • TabNet (Arik and Pfister 2020) • Variational Information Bottleneck (VIB) (Alemi…",,,1,related
"The above three-step procedure mostly originates from the prominent line of work of the Lottery Ticket Hypothesis [16, 8, 17, 19, 38, 44, 66, 67] (or LTH): i.",,,0,not_related
"The above three-step procedure mostly originates from the prominent line of work of the Lottery Ticket Hypothesis [16, 8, 17, 19, 38, 44, 66, 67] (or LTH): i.e., the idea that a pre-trained model contains “lottery tickets” (i.e., smaller subnetworks) such that if we select those “tickets” cleverly, those submodels do not lose much in accuracy while reducing significantly the size of the model.",,,0,not_related
"In addition, the existing pruning approaches usually perform the iterations of parameter removal and accuracy recovery at each layer, making it hard to achieve a global optimum [14], [17] with few retraining iterations.",,,0,not_related
"Consequently, the pruned network can not achieve the optimal accuracy [17].",,,0,not_related
…the performance of TabTransformer against following four categories of methods: (a) Logistic regression and GBDT; (b) MLP and a sparse MLP following Morcos et al. (2019); (c) TabNet model of Arik & Pfister (2019); and (d) the Variational Information Bottleneck model (VIB) of Alemi et al. (2017).,,,1,related
"[34, 35] have studied the lottery ticket hypothesis in unsupervised learning to reveal how well the tickets are transformed between different datasets.",,,0,not_related
"Recent studies of deep learning have demonstrated that redundancy of parameters (deep layers of hidden variables) reduces generalization error, contrary to the implications of Occam’s razor (He et al. 2019; Morcos et al. 2019; Nagarajan and Kolter 2019).",,,0,not_related
"If the hypothesis holds for a given network, then we can reduce the computational cost by using the sparse subnetwork instead of the entire network while maintaining the accuracy [14, 19].",,,1,related
"Many properties and applications have been studied in subsequent works, such as transferability of winning subnetworks [19], sparsification before training [14, 27, 26] and further ablation studies on the hypothesis [29].",,,0,not_related
"…there are still many other promising avenues that could lead to efficient sparse training, for example, transferring existing lottery tickets Morcos et al. (2019); Mehta (2019), pruning weights during training (You et al., 2019), or dynamically changing the mask during training (Evci et…",,,0,not_related
"For example, Morcos et al. (2019) hint at ""the possibility of parameterizing the distribution of such tickets, allowing us to sample generic, dataset-independent winning tickets.""",,,0,not_related
"Another intriguing property of lottery tickets, the transferability, has also been thoroughly examined (Mehta, 2019; Morcos et al., 2019; Desai et al., 2019; Chen et al., 2020b;a).",,,0,not_related
"Although it has been well studied in discriminative models (Mehta, 2019; Morcos et al., 2019; Chen et al., 2020b), an in-depth understanding of transfer learning in GAN tickets is still missing.",,,0,not_related
Mehta (2019); Morcos et al. (2019); Desai et al. (2019) are the pioneers to study the transferability of found subnetworks.,,,0,not_related
"Aside from training from scratch, such winning tickets have demonstrated their abilities to transfer across tasks and datasets (Morcos et al., 2019; Yu et al., 2019; Desai et al., 2019; Chen et al., 2020a).",,,0,not_related
"Besides training from scratch, researchers also explore the existence of winning tickets under transfer learning regimes for over-parametrized pre-trained models across various tasks and datasets (Morcos et al., 2019; Yu et al., 2019; Desai et al., 2019; Chen et al., 2020a).",,,0,not_related
Similar ticket transfer results were reported by Morcos et al. (2019) and Mehta (2019) in the context of optimizers and vision datasets.,,,0,not_related
"Other studies concerned hyperparameters modifications [24, 25], and concentrated on the transferability [16, 26] of the pruned networks.",,,0,not_related
It has been actually shown that the same winning lottery ticket generalizes across training conditions and similar datasets [16].,,,0,not_related
"This directly relates to the good transfer properties of the subnetworks corresponding to the winning tickets [16, 26].",,,1,related
"formance as the original network, when trained in isolation [16, 32].",,,0,not_related
"neural network parameters space properties, gives us insights on the possible existence of low-dimensional manifolds in the network parameter space [14, 16, 20, 30, 32, 37].",,,0,not_related
"The inaccessibility of W∗ has also be noticed in [56]–[58], proving the importance of our NTAA in synchronously learning the network weights and the architecture in the same way as our NTAA.",,,1,related
